הפסוק,פסוק,פרק,ספר,משמעות
הֲ֭תֵדַע בְּשׂוּם־אֱל֣וֹהַּ עֲלֵיהֶ֑ם וְ֝הוֹפִ֗יעַ א֣וֹר עֲנָנֽוֹ׃,טו,לז,Job,11
עָ֭לָיו תִּרְנֶ֣ה אַשְׁפָּ֑ה לַ֖הַב חֲנִ֣ית וְכִידֽוֹן׃,כג,לט,Job,11
מְ֭זִמָּה תִּשְׁמֹ֥ר עָלֶ֗יךָ תְּבוּנָ֥ה תִנְצְרֶֽכָּה׃,יא,ב,Proverbs,11
אַל־תַּחֲרֹ֣שׁ עַל־רֵעֲךָ֣ רָעָ֑ה וְהֽוּא־יוֹשֵׁ֖ב לָבֶ֣טַח אִתָּֽךְ׃,כט,ג,Proverbs,11
אִם־יְהַלֵּ֣ךְ אִ֭ישׁ עַל־הַגֶּחָלִ֑ים וְ֝רַגְלָ֗יו לֹ֣א תִכָּוֶֽינָה׃,כח,ו,Proverbs,1
עַל־כֵּ֭ן יָצָ֣אתִי לִקְרָאתֶ֑ךָ לְשַׁחֵ֥ר פָּ֝נֶ֗יךָ וָאֶמְצָאֶֽךָּ׃,טו,ז,Proverbs,7
בַּהֲכִינ֣וֹ שָׁ֭מַיִם שָׁ֣ם אָ֑נִי בְּח֥וּקוֹ ח֝֗וּג עַל־פְּנֵ֥י תְהֽוֹם׃,כז,ח,Proverbs,2
שָֽׁלְחָ֣ה נַעֲרֹתֶ֣יהָ תִקְרָ֑א עַל־גַּ֝פֵּ֗י מְרֹ֣מֵי קָֽרֶת׃,ג,ט,Proverbs,11
ה֖וֹן מֵהֶ֣בֶל יִמְעָ֑ט וְקֹבֵ֖ץ עַל־יָ֣ד יַרְבֶּֽה׃,יא,יג,Proverbs,2
שַׁח֣וּ רָ֭עִים לִפְנֵ֣י טוֹבִ֑ים וּ֝רְשָׁעִ֗ים עַֽל־שַׁעֲרֵ֥י צַדִּֽיק׃,יט,יד,Proverbs,11
קֶ֤סֶם ׀ עַֽל־שִׂפְתֵי־מֶ֑לֶךְ בְּ֝מִשְׁפָּ֗ט לֹ֣א יִמְעַל־פִּֽיו׃,י,טז,Proverbs,other
מַשְׂכִּ֣יל עַל־דָּ֭בָר יִמְצָא־ט֑וֹב וּבוֹטֵ֖חַ בַּיהוָ֣ה אַשְׁרָֽיו׃,כ,טז,Proverbs,7
אִוֶּ֣לֶת אָ֭דָם תְּסַלֵּ֣ף דַּרְכּ֑וֹ וְעַל־יְ֝הוָ֗ה יִזְעַ֥ף לִבּֽוֹ׃,ג,יט,Proverbs,11
שֵׂ֣כֶל אָ֭דָם הֶאֱרִ֣יךְ אַפּ֑וֹ וְ֝תִפאַרְתּ֗וֹ עֲבֹ֣ר עַל־פָּֽשַׁע׃,יא,יט,Proverbs,7
ט֗וֹב לָשֶׁ֥בֶת עַל־פִּנַּת־גָּ֑ג מֵאֵ֥שֶׁת מִ֝דְיָנִ֗ים וּבֵ֥ית חָֽבֶר׃,ט,כא,Proverbs,1
לַֽמְאַחֲרִ֥ים עַל־הַיָּ֑יִן לַ֝בָּאִ֗ים לַחְקֹ֥ר מִמְסָֽךְ׃,ל,כג,Proverbs,11
וְלַמּוֹכִיחִ֥ים יִנְעָ֑ם וַֽ֝עֲלֵיהֶ֗ם תָּב֥וֹא בִרְכַּת־טֽוֹב׃,כה,כד,Proverbs,11
כִּ֤י גֶֽחָלִ֗ים אַ֭תָּה חֹתֶ֣ה עַל־רֹאשׁ֑וֹ וַֽ֝יהוָ֗ה יְשַׁלֶּם־לָֽךְ׃,כב,כה,Proverbs,11
אֲרִי־נֹ֭הֵם וְדֹ֣ב שׁוֹקֵ֑ק מֹשֵׁ֥ל רָ֝שָׁ֗ע עַ֣ל עַם־דָּֽל׃,טו,כח,Proverbs,11
מֹ֭שֵׁל מַקְשִׁ֣יב עַל־דְּבַר־שָׁ֑קֶר כׇּֽל־מְשָׁרְתָ֥יו רְשָׁעִֽים׃,יב,כט,Proverbs,11
פִּ֭יהָ פָּתְחָ֣ה בְחׇכְמָ֑ה וְתֽוֹרַת־חֶ֝֗סֶד עַל־לְשׁוֹנָֽהּ׃,כו,לא,Proverbs,11
רַבּ֣וֹת בָּ֭נוֹת עָ֣שׂוּ חָ֑יִל וְ֝אַ֗תְּ עָלִ֥ית עַל־כֻּלָּֽנָה׃,כט,לא,Proverbs,11
כֹּ֣ה אָמַ֗ר כֹּ֚רֶשׁ מֶ֣לֶךְ פָּרַ֔ס כֹּ֚ל מַמְלְכ֣וֹת הָאָ֔רֶץ נָ֣תַן לִ֔י יְהוָ֖ה אֱלֹהֵ֣י הַשָּׁמָ֑יִם וְהֽוּא־פָקַ֤ד עָלַי֙ לִבְנֽוֹת־ל֣וֹ בַ֔יִת בִּירוּשָׁלִַ֖ם אֲשֶׁ֥ר בִּֽיהוּדָֽה,ב,א,Ezra,11
וַיּֽוֹצִיאֵ֗ם כּ֚וֹרֶשׁ מֶ֣לֶךְ פָּרַ֔ס עַל־יַ֖ד מִתְרְדָ֣ת הַגִּזְבָּ֑ר וַֽיִּסְפְּרֵם֙ לְשֵׁשְׁבַּצַּ֔ר הַנָּשִׂ֖יא לִיהוּדָֽה׃,ח,א,Ezra,2
וַיִּ֨תְּנוּ־כֶ֔סֶף לַחֹצְבִ֖ים וְלֶחָרָשִׁ֑ים וּמַאֲכָ֨ל וּמִשְׁתֶּ֜ה וָשֶׁ֗מֶן לַצִּֽדֹנִים֙ וְלַצֹּרִ֔ים לְהָבִיא֩ עֲצֵ֨י אֲרָזִ֤ים מִן־הַלְּבָנוֹן֙ אֶל־יָ֣ם יָפ֔וֹא כְּרִשְׁי֛וֹן כּ֥וֹרֶשׁ מֶֽלֶךְ־פָּרַ֖ס עֲלֵיהֶֽם׃,ז,ג,Ezra,11
וַיַּעֲמֹ֣ד יֵשׁ֡וּעַ בָּנָ֣יו וְ֠אֶחָיו קַדְמִיאֵ֨ל וּבָנָ֤יו בְּנֵֽי־יְהוּדָה֙ כְּאֶחָ֔ד לְנַצֵּ֛חַ עַל־עֹשֵׂ֥ה הַמְּלָאכָ֖ה בְּבֵ֣ית הָאֱלֹהִ֑ים ס בְּנֵי֙ חֵֽנָדָ֔ד בְּנֵיהֶ֥ם וַאֲחֵיהֶ֖ם הַלְוִיִּֽם׃,ט,ג,Ezra,11
וְיִסְּד֥וּ הַבֹּנִ֖ים אֶת־הֵיכַ֣ל יְהוָ֑ה וַיַּעֲמִידוּ֩ הַכֹּהֲנִ֨ים מְלֻבָּשִׁ֜ים בַּחֲצֹֽצְר֗וֹת וְהַלְוִיִּ֤ם בְּנֵֽי־אָסָף֙ בַּֽמְצִלְתַּ֔יִם לְהַלֵּל֙ אֶת־יְהוָ֔ה עַל־יְדֵ֖י דָּוִ֥יד מֶֽלֶךְ־יִשְׂרָאֵֽל׃,י,ג,Ezra,other
וּבְמַלְכוּת֙ אֲחַשְׁוֵר֔וֹשׁ בִּתְחִלַּ֖ת מַלְכוּת֑וֹ כָּתְב֣וּ שִׂטְנָ֔ה עַל־יֹשְׁבֵ֥י יְהוּדָ֖ה וִירוּשָׁלִָֽם׃ ס,ו,ד,Ezra,11
רְח֣וּם בְּעֵל־טְעֵ֗ם וְשִׁמְשַׁי֙ סָֽפְרָ֔א כְּתַ֛בוּ אִגְּרָ֥ה חֲדָ֖ה עַל־יְרוּשְׁלֶ֑ם לְאַרְתַּחְשַׁ֥שְׂתְּא מַלְכָּ֖א כְּנֵֽמָא׃,ח,ד,Ezra,11
וּמַלְכִ֣ין תַּקִּיפִ֗ין הֲווֹ֙ עַל־יְר֣וּשְׁלֶ֔ם וְשַׁ֨לִּיטִ֔ין בְּכֹ֖ל עֲבַ֣ר נַהֲרָ֑ה וּמִדָּ֥ה בְל֛וֹ וַהֲלָ֖ךְ מִתְיְהֵ֥ב לְהֽוֹן׃,כ,ד,Ezra,11
וּזְהִירִ֥ין הֱו֛וֹ שָׁל֖וּ לְמֶעְבַּ֣ד עַל־דְּנָ֑ה לְמָה֙ יִשְׂגֵּ֣א חֲבָלָ֔א לְהַנְזָקַ֖ת מַלְכִֽין׃ ס,כב,ד,Ezra,11
שְׁבֻ֕קוּ לַעֲבִידַ֖ת בֵּית־אֱלָהָ֣א דֵ֑ךְ פַּחַ֤ת יְהוּדָיֵא֙ וּלְשָׂבֵ֣י יְהוּדָיֵ֔א בֵּית־אֱלָהָ֥א דֵ֖ךְ יִבְנ֥וֹן עַל־אַתְרֵֽהּ׃,ז,ו,Ezra,11
וַיַּֽעֲשׂ֧וּ חַג־מַצּ֛וֹת שִׁבְעַ֥ת יָמִ֖ים בְּשִׂמְחָ֑ה כִּ֣י ׀ שִׂמְּחָ֣ם יְהוָ֗ה וְֽהֵסֵ֞ב לֵ֤ב מֶֽלֶךְ־אַשּׁוּר֙ עֲלֵיהֶ֔ם לְחַזֵּ֣ק יְדֵיהֶ֔ם בִּמְלֶ֥אכֶת בֵּית־הָאֱלֹהִ֖ים אֱלֹהֵ֥י יִשְׂרָאֵֽל׃ פ,כב,ו,Ezra,11
כִּ֗י בְּאֶחָד֙ לַחֹ֣דֶשׁ הָרִאשׁ֔וֹן ה֣וּא יְסֻ֔ד הַֽמַּעֲלָ֖ה מִבָּבֶ֑ל וּבְאֶחָ֞ד לַחֹ֣דֶשׁ הַחֲמִישִׁ֗י בָּ֚א אֶל־יְר֣וּשָׁלִַ֔ם כְּיַד־אֱלֹהָ֖יו הַטּוֹבָ֥ה עָלָֽיו׃,ט,ז,Ezra,11
כׇּל־קֳבֵ֗ל דִּי֩ מִן־קֳדָ֨ם מַלְכָּ֜א וְשִׁבְעַ֤ת יָעֲטֹ֨הִי֙ שְׁלִ֔יחַ לְבַקָּרָ֥א עַל־יְה֖וּד וְלִֽירוּשְׁלֶ֑ם בְּדָ֥ת אֱלָהָ֖ךְ דִּ֥י בִידָֽךְ׃,יד,ז,Ezra,11
וָאֶקְרָ֨א שָׁ֥ם צוֹם֙ עַל־הַנָּהָ֣ר אַהֲוָ֔א לְהִתְעַנּ֖וֹת לִפְנֵ֣י אֱלֹהֵ֑ינוּ לְבַקֵּ֤שׁ מִמֶּ֨נּוּ֙ דֶּ֣רֶךְ יְשָׁרָ֔ה לָ֥נוּ וּלְטַפֵּ֖נוּ וּלְכׇל־רְכוּשֵֽׁנוּ׃,כא,ח,Ezra,2
וַנָּצ֛וּמָה וַנְּבַקְשָׁ֥ה מֵאֱלֹהֵ֖ינוּ עַל־זֹ֑את וַיֵּעָתֵ֖ר לָֽנוּ׃,כג,ח,Ezra,7
וָאֶשְׁקֲלָ֨ה עַל־יָדָ֜ם כֶּ֗סֶף כִּכָּרִים֙ שֵֽׁשׁ־מֵא֣וֹת וַחֲמִשִּׁ֔ים וּכְלֵי־כֶ֥סֶף מֵאָ֖ה לְכִכָּרִ֑ים זָהָ֖ב מֵאָ֥ה כִכָּֽר׃,כו,ח,Ezra,other
וְאַֽחֲרֵי֙ כׇּל־הַבָּ֣א עָלֵ֔ינוּ בְּמַעֲשֵׂ֨ינוּ֙ הָרָעִ֔ים וּבְאַשְׁמָתֵ֖נוּ הַגְּדֹלָ֑ה כִּ֣י ׀ אַתָּ֣ה אֱלֹהֵ֗ינוּ חָשַׂ֤כְתָּֽ לְמַ֨טָּה֙ מֵֽעֲוֹנֵ֔נוּ וְנָתַ֥תָּה לָּ֛נוּ פְּלֵיטָ֖ה כָּזֹֽאת׃,יג,ט,Ezra,11
יְהוָ֞ה אֱלֹהֵ֤י יִשְׂרָאֵל֙ צַדִּ֣יק אַ֔תָּה כִּֽי־נִשְׁאַ֥רְנוּ פְלֵיטָ֖ה כְּהַיּ֣וֹם הַזֶּ֑ה הִנְנ֤וּ לְפָנֶ֨יךָ֙ בְּאַשְׁמָתֵ֔ינוּ כִּ֣י אֵ֥ין לַעֲמ֛וֹד לְפָנֶ֖יךָ עַל־זֹֽאת׃ פ,טו,ט,Ezra,7
ק֛וּם כִּֽי־עָלֶ֥יךָ הַדָּבָ֖ר וַאֲנַ֣חְנוּ עִמָּ֑ךְ חֲזַ֖ק וַעֲשֵֽׂה׃ פ,ד,י,Ezra,11
וַיִּתְּנ֥וּ יָדָ֖ם לְהוֹצִ֣יא נְשֵׁיהֶ֑ם וַאֲשֵׁמִ֥ים אֵֽיל־צֹ֖אן עַל־אַשְׁמָתָֽם׃ ס,יט,י,Ezra,7
עַל־כֵּן֙ תָּפ֣וּג תּוֹרָ֔ה וְלֹֽא־יֵצֵ֥א לָנֶ֖צַח מִשְׁפָּ֑ט כִּ֤י רָשָׁע֙ מַכְתִּ֣יר אֶת־הַצַּדִּ֔יק עַל־כֵּ֛ן יֵצֵ֥א מִשְׁפָּ֖ט מְעֻקָּֽל׃,ד,א,Habakkuk,7
כֻּלֹּה֙ בְּחַכָּ֣ה הֵֽעֲלָ֔ה יְגֹרֵ֣הוּ בְחֶרְמ֔וֹ וְיַאַסְפֵ֖הוּ בְּמִכְמַרְתּ֑וֹ עַל־כֵּ֖ן יִשְׂמַ֥ח וְיָגִֽיל׃,טו,א,Habakkuk,7
עַל־כֵּן֙ יְזַבֵּ֣חַ לְחֶרְמ֔וֹ וִֽיקַטֵּ֖ר לְמִכְמַרְתּ֑וֹ כִּ֤י בָהֵ֨מָּה֙ שָׁמֵ֣ן חֶלְק֔וֹ וּמַאֲכָל֖וֹ בְּרִאָֽה׃,טז,א,Habakkuk,7
עַל־מִשְׁמַרְתִּ֣י אֶעֱמֹ֔דָה וְאֶֽתְיַצְּבָ֖ה עַל־מָצ֑וֹר וַאֲצַפֶּ֗ה לִרְאוֹת֙ מַה־יְדַבֶּר־בִּ֔י וּמָ֥ה אָשִׁ֖יב עַל־תּוֹכַחְתִּֽי׃,א,ב,Habakkuk,11
וַיַּעֲנֵ֤נִי יְהוָה֙ וַיֹּ֔אמֶר כְּת֣וֹב חָז֔וֹן וּבָאֵ֖ר עַל־הַלֻּח֑וֹת לְמַ֥עַן יָר֖וּץ ק֥וֹרֵא בֽוֹ׃,ב,ב,Habakkuk,11
הֲלוֹא־אֵ֣לֶּה כֻלָּ֗ם עָלָיו֙ מָשָׁ֣ל יִשָּׂ֔אוּ וּמְלִיצָ֖ה חִיד֣וֹת ל֑וֹ וְיֹאמַ֗ר ה֚וֹי הַמַּרְבֶּ֣ה לֹּא־ל֔וֹ עַד־מָתַ֕י וּמַכְבִּ֥יד עָלָ֖יו עַבְטִֽיט׃,ו,ב,Habakkuk,11
כִּ֚י תִּמָּלֵ֣א הָאָ֔רֶץ לָדַ֖עַת אֶת־כְּב֣וֹד יְהוָ֑ה כַּמַּ֖יִם יְכַסּ֥וּ עַל־יָֽם׃ ס,יד,ב,Habakkuk,11
ה֚וֹי מַשְׁקֵ֣ה רֵעֵ֔הוּ מְסַפֵּ֥חַ חֲמָתְךָ֖ וְאַ֣ף שַׁכֵּ֑ר לְמַ֥עַן הַבִּ֖יט עַל־מְעוֹרֵיהֶֽם׃,טו,ב,Habakkuk,11
תְּפִלָּ֖ה לַחֲבַקּ֣וּק הַנָּבִ֑יא עַ֖ל שִׁגְיֹנֽוֹת׃,א,ג,Habakkuk,other
יְהוִ֤ה אֲדֹנָי֙ חֵילִ֔י וַיָּ֤שֶׂם רַגְלַי֙ כָּֽאַיָּל֔וֹת וְעַ֥ל בָּמוֹתַ֖י יַדְרִכֵ֑נִי לַמְנַצֵּ֖חַ בִּנְגִינוֹתָֽי׃,יט,ג,Habakkuk,1
ק֠וּם לֵ֧ךְ אֶל־נִֽינְוֵ֛ה הָעִ֥יר הַגְּדוֹלָ֖ה וּקְרָ֣א עָלֶ֑יהָ כִּֽי־עָלְתָ֥ה רָעָתָ֖ם לְפָנָֽי׃,ב,א,Jonah,11
וַיֹּאמְר֞וּ אִ֣ישׁ אֶל־רֵעֵ֗הוּ לְכוּ֙ וְנַפִּ֣ילָה גֽוֹרָל֔וֹת וְנֵ֣דְעָ֔ה בְּשֶׁלְּמִ֛י הָרָעָ֥ה הַזֹּ֖את לָ֑נוּ וַיַּפִּ֨לוּ֙ גּֽוֹרָל֔וֹת וַיִּפֹּ֥ל הַגּוֹרָ֖ל עַל־יוֹנָֽה׃,ז,א,Jonah,other
וַיֹּ֣אמֶר אֲלֵיהֶ֗ם שָׂא֨וּנִי֙ וַהֲטִילֻ֣נִי אֶל־הַיָּ֔ם וְיִשְׁתֹּ֥ק הַיָּ֖ם מֵֽעֲלֵיכֶ֑ם כִּ֚י יוֹדֵ֣עַ אָ֔נִי כִּ֣י בְשֶׁלִּ֔י הַסַּ֧עַר הַגָּד֛וֹל הַזֶּ֖ה עֲלֵיכֶֽם׃,יב,א,Jonah,11
וַיַּחְתְּר֣וּ הָאֲנָשִׁ֗ים לְהָשִׁ֛יב אֶל־הַיַּבָּשָׁ֖ה וְלֹ֣א יָכֹ֑לוּ כִּ֣י הַיָּ֔ם הוֹלֵ֥ךְ וְסֹעֵ֖ר עֲלֵיהֶֽם׃,יג,א,Jonah,11
וַיִּקְרְא֨וּ אֶל־יְהוָ֜ה וַיֹּאמְר֗וּ אָנָּ֤ה יְהוָה֙ אַל־נָ֣א נֹאבְדָ֗ה בְּנֶ֨פֶשׁ֙ הָאִ֣ישׁ הַזֶּ֔ה וְאַל־תִּתֵּ֥ן עָלֵ֖ינוּ דָּ֣ם נָקִ֑יא כִּֽי־אַתָּ֣ה יְהוָ֔ה כַּאֲשֶׁ֥ר חָפַ֖צְתָּ עָשִֽׂיתָ׃,יד,א,Jonah,11
וַיִּקְרְא֨וּ אֶל־יְהוָ֜ה וַיֹּאמְר֗וּ אָנָּ֤ה יְהוָה֙ אַל־נָ֣א נֹאבְדָ֗ה בְּנֶ֨פֶשׁ֙ הָאִ֣ישׁ הַזֶּ֔ה וְאַל־תִּתֵּ֥ן עָלֵ֖ינוּ דָּ֣ם נָקִ֑יא כִּֽי־אַתָּ֣ה יְהוָ֔ה כַּאֲשֶׁ֥ר חָפַ֖צְתָּ עָשִֽׂיתָ׃,ו,ג,Jonah,11
וַיַּ֤רְא הָֽאֱלֹהִים֙ אֶֽת־מַ֣עֲשֵׂיהֶ֔ם כִּי־שָׁ֖בוּ מִדַּרְכָּ֣ם הָרָעָ֑ה וַיִּנָּ֣חֶם הָאֱלֹהִ֗ים עַל־הָרָעָ֛ה אֲשֶׁר־דִּבֶּ֥ר לַעֲשׂוֹת־לָהֶ֖ם וְלֹ֥א עָשָֽׂה׃,י,ג,Jonah,other
וַיְהִ֣י ׀ כִּזְרֹ֣חַ הַשֶּׁ֗מֶשׁ וַיְמַ֨ן אֱלֹהִ֜ים ר֤וּחַ קָדִים֙ חֲרִישִׁ֔ית וַתַּ֥ךְ הַשֶּׁ֛מֶשׁ עַל־רֹ֥אשׁ יוֹנָ֖ה וַיִּתְעַלָּ֑ף וַיִּשְׁאַ֤ל אֶת־נַפְשׁוֹ֙ לָמ֔וּת וַיֹּ֕אמֶר ט֥וֹב מוֹתִ֖י מֵחַיָּֽי׃,ח,ד,Jonah,1
וַיֹּ֤אמֶר אֱלֹהִים֙ אֶל־יוֹנָ֔ה הַהֵיטֵ֥ב חָרָֽה־לְךָ֖ עַל־הַקִּֽיקָי֑וֹן וַיֹּ֕אמֶר הֵיטֵ֥ב חָֽרָה־לִ֖י עַד־מָֽוֶת׃,ט,ד,Jonah,11
וַיֹּ֣אמֶר יְהוָ֔ה אַתָּ֥ה חַ֨סְתָּ֙ עַל־הַקִּ֣יקָי֔וֹן אֲשֶׁ֛ר לֹא־עָמַ֥לְתָּ בּ֖וֹ וְלֹ֣א גִדַּלְתּ֑וֹ שֶׁבִּן־לַ֥יְלָה הָיָ֖ה וּבִן־לַ֥יְלָה אָבָֽד׃,י,ד,Jonah,11
וְאֵ֨ת כׇּל־הָעֵדָ֜ה הִקְהִ֗ילוּ בְּאֶחָד֙ לַחֹ֣דֶשׁ הַשֵּׁנִ֔י וַיִּתְיַֽלְד֥וּ עַל־מִשְׁפְּחֹתָ֖ם לְבֵ֣ית אֲבֹתָ֑ם בְּמִסְפַּ֣ר שֵׁמ֗וֹת מִבֶּ֨ן עֶשְׂרִ֥ים שָׁנָ֛ה וָמַ֖עְלָה לְגֻלְגְּלֹתָֽם׃,יח,א,Numbers,7
וְאַתָּ֡ה הַפְקֵ֣ד אֶת־הַלְוִיִּם֩ עַל־מִשְׁכַּ֨ן הָעֵדֻ֜ת וְעַ֣ל כׇּל־כֵּלָיו֮ וְעַ֣ל כׇּל־אֲשֶׁר־לוֹ֒ הֵ֜מָּה יִשְׂא֤וּ אֶת־הַמִּשְׁכָּן֙ וְאֶת־כׇּל־כֵּלָ֔יו וְהֵ֖ם יְשָׁרְתֻ֑הוּ וְסָבִ֥יב לַמִּשְׁכָּ֖ן יַחֲנֽוּ׃,נ,א,Numbers,11
וְחָנ֖וּ בְּנֵ֣י יִשְׂרָאֵ֑ל אִ֧ישׁ עַֽל־מַחֲנֵ֛הוּ וְאִ֥ישׁ עַל־דִּגְל֖וֹ לְצִבְאֹתָֽם׃,נב,א,Numbers,2
הַלְוִיִּ֞ם יַחֲנ֤וּ סָבִיב֙ לְמִשְׁכַּ֣ן הָעֵדֻ֔ת וְלֹֽא־יִהְיֶ֣ה קֶ֔צֶף עַל־עֲדַ֖ת בְּנֵ֣י יִשְׂרָאֵ֑ל וְשָׁמְרוּ֙ הַלְוִיִּ֔ם אֶת־מִשְׁמֶ֖רֶת מִשְׁכַּ֥ן הָעֵדֽוּת׃,נג,א,Numbers,11
אִ֣ישׁ עַל־דִּגְל֤וֹ בְאֹתֹת֙ לְבֵ֣ית אֲבֹתָ֔ם יַחֲנ֖וּ בְּנֵ֣י יִשְׂרָאֵ֑ל מִנֶּ֕גֶד סָבִ֥יב לְאֹֽהֶל־מוֹעֵ֖ד יַחֲנֽוּ׃,ב,ב,Numbers,2
וְנָסַ֧ע אֹֽהֶל־מוֹעֵ֛ד מַחֲנֵ֥ה הַלְוִיִּ֖ם בְּת֣וֹךְ הַֽמַּחֲנֹ֑ת כַּאֲשֶׁ֤ר יַחֲנוּ֙ כֵּ֣ן יִסָּ֔עוּ אִ֥ישׁ עַל־יָד֖וֹ לְדִגְלֵיהֶֽם׃,יז,ב,Numbers,2
וַֽיַּעֲשׂ֖וּ בְּנֵ֣י יִשְׂרָאֵ֑ל כְּ֠כֹל אֲשֶׁר־צִוָּ֨ה יְהוָ֜ה אֶת־מֹשֶׁ֗ה כֵּֽן־חָנ֤וּ לְדִגְלֵיהֶם֙ וְכֵ֣ן נָסָ֔עוּ אִ֥ישׁ לְמִשְׁפְּחֹתָ֖יו עַל־בֵּ֥ית אֲבֹתָֽיו׃,לד,ב,Numbers,3
וַיָּ֣מׇת נָדָ֣ב וַאֲבִיה֣וּא לִפְנֵ֣י יְהוָ֡ה בְּֽהַקְרִבָם֩ אֵ֨שׁ זָרָ֜ה לִפְנֵ֤י יְהוָה֙ בְּמִדְבַּ֣ר סִינַ֔י וּבָנִ֖ים לֹא־הָי֣וּ לָהֶ֑ם וַיְכַהֵ֤ן אֶלְעָזָר֙ וְאִ֣יתָמָ֔ר עַל־פְּנֵ֖י אַהֲרֹ֥ן אֲבִיהֶֽם׃,ד,ג,Numbers,7
וַיִּפְקֹ֥ד אֹתָ֛ם מֹשֶׁ֖ה עַל־פִּ֣י יְהוָ֑ה כַּאֲשֶׁ֖ר צֻוָּֽה׃,טז,ג,Numbers,11
מִשְׁפְּחֹ֥ת בְּנֵי־קְהָ֖ת יַחֲנ֑וּ עַ֛ל יֶ֥רֶךְ הַמִּשְׁכָּ֖ן תֵּימָֽנָה׃,כט,ג,Numbers,1
וּנְשִׂ֤יא בֵֽית־אָב֙ לְמִשְׁפְּחֹ֣ת מְרָרִ֔י צוּרִיאֵ֖ל בֶּן־אֲבִיחָ֑יִל עַ֣ל יֶ֧רֶךְ הַמִּשְׁכָּ֛ן יַחֲנ֖וּ צָפֹֽנָה׃,לה,ג,Numbers,1
כׇּל־פְּקוּדֵ֨י הַלְוִיִּ֜ם אֲשֶׁר֩ פָּקַ֨ד מֹשֶׁ֧ה וְאַהֲרֹ֛ן עַל־פִּ֥י יְהוָ֖ה לְמִשְׁפְּחֹתָ֑ם כׇּל־זָכָר֙ מִבֶּן־חֹ֣דֶשׁ וָמַ֔עְלָה שְׁנַ֥יִם וְעֶשְׂרִ֖ים אָֽלֶף׃,לט,ג,Numbers,11
וְאֵת֙ פְּדוּיֵ֣י הַשְּׁלֹשָׁ֔ה וְהַשִּׁבְעִ֖ים וְהַמָּאתָ֑יִם הָעֹֽדְפִים֙ עַל־הַלְוִיִּ֔ם מִבְּכ֖וֹר בְּנֵ֥י יִשְׂרָאֵֽל׃,מו,ג,Numbers,7
וַיִּקַּ֣ח מֹשֶׁ֔ה אֵ֖ת כֶּ֣סֶף הַפִּדְי֑וֹם מֵאֵת֙ הָעֹ֣דְפִ֔ים עַ֖ל פְּדוּיֵ֥י הַלְוִיִּֽם׃,מט,ג,Numbers,7
וַיִּתֵּ֨ן מֹשֶׁ֜ה אֶת־כֶּ֧סֶף הַפְּדֻיִ֛ם לְאַהֲרֹ֥ן וּלְבָנָ֖יו עַל־פִּ֣י יְהוָ֑ה כַּאֲשֶׁ֛ר צִוָּ֥ה יְהוָ֖ה אֶת־מֹשֶֽׁה׃,נא,ג,Numbers,11
וְנָתְנ֤וּ אֹתָהּ֙ וְאֶת־כׇּל־כֵּלֶ֔יהָ אֶל־מִכְסֵ֖ה ע֣וֹר תָּ֑חַשׁ וְנָתְנ֖וּ עַל־הַמּֽוֹט׃,י,ד,Numbers,1
וְלָקְחוּ֩ אֶת־כׇּל־כְּלֵ֨י הַשָּׁרֵ֜ת אֲשֶׁ֧ר יְשָֽׁרְתוּ־בָ֣ם בַּקֹּ֗דֶשׁ וְנָֽתְנוּ֙ אֶל־בֶּ֣גֶד תְּכֵ֔לֶת וְכִסּ֣וּ אוֹתָ֔ם בְּמִכְסֵ֖ה ע֣וֹר תָּ֑חַשׁ וְנָתְנ֖וּ עַל־הַמּֽוֹט׃,יב,ד,Numbers,1
וְזֹ֣את ׀ עֲשׂ֣וּ לָהֶ֗ם וְחָיוּ֙ וְלֹ֣א יָמֻ֔תוּ בְּגִשְׁתָּ֖ם אֶת־קֹ֣דֶשׁ הַקֳּדָשִׁ֑ים אַהֲרֹ֤ן וּבָנָיו֙ יָבֹ֔אוּ וְשָׂמ֣וּ אוֹתָ֗ם אִ֥ישׁ אִ֛ישׁ עַל־עֲבֹדָת֖וֹ וְאֶל־מַשָּׂאֽוֹ׃,יט,ד,Numbers,11
אֵ֤לֶּה פְקוּדֵי֙ מִשְׁפְּחֹ֣ת הַקְּהָתִ֔י כׇּל־הָעֹבֵ֖ד בְּאֹ֣הֶל מוֹעֵ֑ד אֲשֶׁ֨ר פָּקַ֤ד מֹשֶׁה֙ וְאַהֲרֹ֔ן עַל־פִּ֥י יְהוָ֖ה בְּיַד־מֹשֶֽׁה׃,לז,ד,Numbers,11
אֵ֣לֶּה פְקוּדֵ֗י מִשְׁפְּחֹת֙ בְּנֵ֣י גֵרְשׁ֔וֹן כׇּל־הָעֹבֵ֖ד בְּאֹ֣הֶל מוֹעֵ֑ד אֲשֶׁ֨ר פָּקַ֥ד מֹשֶׁ֛ה וְאַהֲרֹ֖ן עַל־פִּ֥י יְהוָֽה׃,מא,ד,Numbers,11
אֵ֣לֶּה פְקוּדֵ֔י מִשְׁפְּחֹ֖ת בְּנֵ֣י מְרָרִ֑י אֲשֶׁ֨ר פָּקַ֤ד מֹשֶׁה֙ וְאַהֲרֹ֔ן עַל־פִּ֥י יְהוָ֖ה בְּיַד־מֹשֶֽׁה׃,מה,ד,Numbers,11
וְהֶעֱמִ֨יד הַכֹּהֵ֥ן אֶֽת־הָאִשָּׁה֮ לִפְנֵ֣י יְהוָה֒ וּפָרַע֙ אֶת־רֹ֣אשׁ הָֽאִשָּׁ֔ה וְנָתַ֣ן עַל־כַּפֶּ֗יהָ אֵ֚ת מִנְחַ֣ת הַזִּכָּר֔וֹן מִנְחַ֥ת קְנָאֹ֖ת הִ֑וא וּבְיַ֤ד הַכֹּהֵן֙ יִהְי֔וּ מֵ֥י הַמָּרִ֖ים הַמְאָֽרֲרִֽים׃,יח,ה,Numbers,1
כׇּל־יְמֵי֙ נֶ֣דֶר נִזְר֔וֹ תַּ֖עַר לֹא־יַעֲבֹ֣ר עַל־רֹאשׁ֑וֹ עַד־מְלֹ֨את הַיָּמִ֜ם אֲשֶׁר־יַזִּ֤יר לַיהוָה֙ קָדֹ֣שׁ יִהְיֶ֔ה גַּדֵּ֥ל פֶּ֖רַע שְׂעַ֥ר רֹאשֽׁוֹ׃,ה,ו,Numbers,11
כׇּל־יְמֵ֥י הַזִּיר֖וֹ לַיהוָ֑ה עַל־נֶ֥פֶשׁ מֵ֖ת לֹ֥א יָבֹֽא׃,ו,ו,Numbers,3
לְאָבִ֣יו וּלְאִמּ֗וֹ לְאָחִיו֙ וּלְאַ֣חֹת֔וֹ לֹא־יִטַּמָּ֥א לָהֶ֖ם בְּמֹתָ֑ם כִּ֛י נֵ֥זֶר אֱלֹהָ֖יו עַל־רֹאשֽׁוֹ׃,ז,ו,Numbers,11
וְאֶת־הָאַ֜יִל יַעֲשֶׂ֨ה זֶ֤בַח שְׁלָמִים֙ לַֽיהוָ֔ה עַ֖ל סַ֣ל הַמַּצּ֑וֹת וְעָשָׂה֙ הַכֹּהֵ֔ן אֶת־מִנְחָת֖וֹ וְאֶת־נִסְכּֽוֹ׃,יז,ו,Numbers,1
וְגִלַּ֣ח הַנָּזִ֗יר פֶּ֛תַח אֹ֥הֶל מוֹעֵ֖ד אֶת־רֹ֣אשׁ נִזְר֑וֹ וְלָקַ֗ח אֶת־שְׂעַר֙ רֹ֣אשׁ נִזְר֔וֹ וְנָתַן֙ עַל־הָאֵ֔שׁ אֲשֶׁר־תַּ֖חַת זֶ֥בַח הַשְּׁלָמִֽים׃,יח,ו,Numbers,1
וְלָקַ֨ח הַכֹּהֵ֜ן אֶת־הַזְּרֹ֣עַ בְּשֵׁלָה֮ מִן־הָאַיִל֒ וְֽחַלַּ֨ת מַצָּ֤ה אַחַת֙ מִן־הַסַּ֔ל וּרְקִ֥יק מַצָּ֖ה אֶחָ֑ד וְנָתַן֙ עַל־כַּפֵּ֣י הַנָּזִ֔יר אַחַ֖ר הִֽתְגַּלְּח֥וֹ אֶת־נִזְרֽוֹ׃,יט,ו,Numbers,1
וְשָׂמ֥וּ אֶת־שְׁמִ֖י עַל־בְּנֵ֣י יִשְׂרָאֵ֑ל וַאֲנִ֖י אֲבָרֲכֵֽם׃,כז,ו,Numbers,11
וַיַּקְרִ֨יבוּ֙ נְשִׂיאֵ֣י יִשְׂרָאֵ֔ל רָאשֵׁ֖י בֵּ֣ית אֲבֹתָ֑ם הֵ֚ם נְשִׂיאֵ֣י הַמַּטֹּ֔ת הֵ֥ם הָעֹמְדִ֖ים עַל־הַפְּקֻדִֽים׃,ב,ז,Numbers,11
וַיָּבִ֨יאוּ אֶת־קׇרְבָּנָ֜ם לִפְנֵ֣י יְהוָ֗ה שֵׁשׁ־עֶגְלֹ֥ת צָב֙ וּשְׁנֵ֣י עָשָׂ֣ר בָּקָ֔ר עֲגָלָ֛ה עַל־שְׁנֵ֥י הַנְּשִׂאִ֖ים וְשׁ֣וֹר לְאֶחָ֑ד וַיַּקְרִ֥יבוּ אוֹתָ֖ם לִפְנֵ֥י הַמִּשְׁכָּֽן׃,ג,ז,Numbers,1
וְהִקְרַבְתָּ֥ אֶת־הַלְוִיִּ֖ם לִפְנֵ֣י יְהוָ֑ה וְסָמְכ֧וּ בְנֵי־יִשְׂרָאֵ֛ל אֶת־יְדֵיהֶ֖ם עַל־הַלְוִיִּֽם׃,י,ח,Numbers,11
וָאֶתְּנָ֨ה אֶת־הַלְוִיִּ֜ם נְתֻנִ֣ים ׀ לְאַהֲרֹ֣ן וּלְבָנָ֗יו מִתּוֹךְ֮ בְּנֵ֣י יִשְׂרָאֵל֒ לַעֲבֹ֞ד אֶת־עֲבֹדַ֤ת בְּנֵֽי־יִשְׂרָאֵל֙ בְּאֹ֣הֶל מוֹעֵ֔ד וּלְכַפֵּ֖ר עַל־בְּנֵ֣י יִשְׂרָאֵ֑ל וְלֹ֨א יִהְיֶ֜ה בִּבְנֵ֤י יִשְׂרָאֵל֙ נֶ֔גֶף בְּגֶ֥שֶׁת בְּנֵֽי־יִשְׂרָאֵ֖ל אֶל־הַקֹּֽדֶשׁ׃,יט,ח,Numbers,11
וְאַחֲרֵי־כֵ֞ן בָּ֣אוּ הַלְוִיִּ֗ם לַעֲבֹ֤ד אֶת־עֲבֹֽדָתָם֙ בְּאֹ֣הֶל מוֹעֵ֔ד לִפְנֵ֥י אַהֲרֹ֖ן וְלִפְנֵ֣י בָנָ֑יו כַּאֲשֶׁר֩ צִוָּ֨ה יְהוָ֤ה אֶת־מֹשֶׁה֙ עַל־הַלְוִיִּ֔ם כֵּ֖ן עָשׂ֥וּ לָהֶֽם׃,כב,ח,Numbers,11
בַּחֹ֨דֶשׁ הַשֵּׁנִ֜י בְּאַרְבָּעָ֨ה עָשָׂ֥ר י֛וֹם בֵּ֥ין הָעַרְבַּ֖יִם יַעֲשׂ֣וּ אֹת֑וֹ עַל־מַצּ֥וֹת וּמְרֹרִ֖ים יֹאכְלֻֽהוּ׃,יא,ט,Numbers,1
וּבְיוֹם֙ הָקִ֣ים אֶת־הַמִּשְׁכָּ֔ן כִּסָּ֤ה הֶֽעָנָן֙ אֶת־הַמִּשְׁכָּ֔ן לְאֹ֖הֶל הָעֵדֻ֑ת וּבָעֶ֜רֶב יִהְיֶ֧ה עַֽל־הַמִּשְׁכָּ֛ן כְּמַרְאֵה־אֵ֖שׁ עַד־בֹּֽקֶר׃,טו,ט,Numbers,1
וּבְהַאֲרִ֧יךְ הֶֽעָנָ֛ן עַל־הַמִּשְׁכָּ֖ן יָמִ֣ים רַבִּ֑ים וְשָׁמְר֧וּ בְנֵי־יִשְׂרָאֵ֛ל אֶת־מִשְׁמֶ֥רֶת יְהוָ֖ה וְלֹ֥א יִסָּֽעוּ׃,כ,ט,Numbers,3
