הפסוק,פסוק,פרק,ספר,משמעות
וַיִּצֹ֣ק ל֗וֹ אַרְבַּע֙ טַבְּעֹ֣ת זָהָ֔ב עַ֖ל אַרְבַּ֣ע פַּעֲמֹתָ֑יו וּשְׁתֵּ֣י טַבָּעֹ֗ת עַל־צַלְעוֹ֙ הָֽאֶחָ֔ת וּשְׁתֵּי֙ טַבָּע֔וֹת עַל־צַלְע֖וֹ הַשֵּׁנִֽית׃,ג',"ל""ז",Exodus,1
וַיָּ֥קׇם מֶֽלֶךְ־חָדָ֖שׁ עַל־מִצְרָ֑יִם אֲשֶׁ֥ר לֹֽא־יָדַ֖ע אֶת־יוֹסֵֽף׃,ח',א',Exodus,11
וַיָּשִׂ֤ימוּ עָלָיו֙ שָׂרֵ֣י מִסִּ֔ים לְמַ֥עַן עַנֹּת֖וֹ בְּסִבְלֹתָ֑ם וַיִּ֜בֶן עָרֵ֤י מִסְכְּנוֹת֙ לְפַרְעֹ֔ה אֶת־פִּתֹ֖ם וְאֶת־רַעַמְסֵֽס׃,"י""א",א',Exodus,11
וַיִּשְׁמַ֤ע פַּרְעֹה֙ אֶת־הַדָּבָ֣ר הַזֶּ֔ה וַיְבַקֵּ֖שׁ לַהֲרֹ֣ג אֶת־מֹשֶׁ֑ה וַיִּבְרַ֤ח מֹשֶׁה֙ מִפְּנֵ֣י פַרְעֹ֔ה וַיֵּ֥שֶׁב בְּאֶֽרֶץ־מִדְיָ֖ן וַיֵּ֥שֶׁב עַֽל־הַבְּאֵֽר׃,"ט""ו",ב',Exodus,2
וְשָׁמְע֖וּ לְקֹלֶ֑ךָ וּבָאתָ֡ אַתָּה֩ וְזִקְנֵ֨י יִשְׂרָאֵ֜ל אֶל־מֶ֣לֶךְ מִצְרַ֗יִם וַאֲמַרְתֶּ֤ם אֵלָיו֙ יְהוָ֞ה אֱלֹהֵ֤י הָֽעִבְרִיִּים֙ נִקְרָ֣ה עָלֵ֔ינוּ וְעַתָּ֗ה נֵֽלֲכָה־נָּ֞א דֶּ֣רֶךְ שְׁלֹ֤שֶׁת יָמִים֙ בַּמִּדְבָּ֔ר וְנִזְבְּחָ֖ה לַֽיהוָ֥ה אֱלֹהֵֽינוּ׃,"י""ב",ג',Exodus,3
וַיֹּ֨אמֶר֙ כִּֽי־אֶֽהְיֶ֣ה עִמָּ֔ךְ וְזֶה־לְּךָ֣ הָא֔וֹת כִּ֥י אָנֹכִ֖י שְׁלַחְתִּ֑יךָ בְּהוֹצִֽיאֲךָ֤ אֶת־הָעָם֙ מִמִּצְרַ֔יִם תַּֽעַבְדוּן֙ אֶת־הָ֣אֱלֹהִ֔ים עַ֖ל הָהָ֥ר הַזֶּֽה׃,"י""ח",ג',Exodus,2
וְשָׁאֲלָ֨ה אִשָּׁ֤ה מִשְּׁכֶנְתָּהּ֙ וּמִגָּרַ֣ת בֵּיתָ֔הּ כְּלֵי־כֶ֛סֶף וּכְלֵ֥י זָהָ֖ב וּשְׂמָלֹ֑ת וְשַׂמְתֶּ֗ם עַל־בְּנֵיכֶם֙ וְעַל־בְּנֹ֣תֵיכֶ֔ם וְנִצַּלְתֶּ֖ם אֶת־מִצְרָֽיִם׃,"כ""ב",ג',Exodus,2
לֵ֣ךְ אֶל־פַּרְעֹ֞ה בַּבֹּ֗קֶר הִנֵּה֙ יֹצֵ֣א הַמַּ֔יְמָה וְנִצַּבְתָּ֥ לִקְרָאת֖וֹ עַל־שְׂפַ֣ת הַיְאֹ֑ר וְהַמַּטֶּ֛ה אֲשֶׁר־נֶהְפַּ֥ךְ לְנָחָ֖שׁ תִּקַּ֥ח בְּיָדֶֽךָ׃,"ט""ו",ז',Exodus,2
וַיֹּ֨אמֶר יְהוָ֜ה אֶל־מֹשֶׁ֗ה נְטֵ֤ה אֶת־יָֽדְךָ֙ עַל־הַשָּׁמַ֔יִם וִיהִ֥י בָרָ֖ד בְּכׇל־אֶ֣רֶץ מִצְרָ֑יִם עַל־הָאָדָ֣ם וְעַל־הַבְּהֵמָ֗ה וְעַ֛ל כׇּל־עֵ֥שֶׂב הַשָּׂדֶ֖ה בְּאֶ֥רֶץ מִצְרָֽיִם׃,"כ""ב",ט',Exodus,3
וְלָֽקְחוּ֙ מִן־הַדָּ֔ם וְנָֽתְנ֛וּ עַל־שְׁתֵּ֥י הַמְּזוּזֹ֖ת וְעַל־הַמַּשְׁק֑וֹף עַ֚ל הַבָּ֣תִּ֔ים אֲשֶׁר־יֹאכְל֥וּ אֹת֖וֹ בָּהֶֽם׃,ז',"י""ב",Exodus,1
וְאַתָּ֞ה הָרֵ֣ם אֶֽת־מַטְּךָ֗ וּנְטֵ֧ה אֶת־יָדְךָ֛ עַל־הַיָּ֖ם וּבְקָעֵ֑הוּ וְיָבֹ֧אוּ בְנֵֽי־יִשְׂרָאֵ֛ל בְּת֥וֹךְ הַיָּ֖ם בַּיַּבָּשָֽׁה׃,"ט""ז","י""ד",Exodus,3
וַיִּלֹּ֧נוּ הָעָ֛ם עַל־מֹשֶׁ֥ה לֵּאמֹ֖ר מַה־נִּשְׁתֶּֽה׃,"כ""ד","ט""ו",Exodus,11
וְהָיָ֥ה עַֽל־אַהֲרֹ֖ן לְשָׁרֵ֑ת וְנִשְׁמַ֣ע ק֠וֹלוֹ בְּבֹא֨וֹ אֶל־הַקֹּ֜דֶשׁ לִפְנֵ֧י יְהוָ֛ה וּבְצֵאת֖וֹ וְלֹ֥א יָמֽוּת׃,"ל""ה","כ""ח",Exodus,7
וְלָֽקַחְתָּ֙ אֶת־שֶׁ֣מֶן הַמִּשְׁחָ֔ה וְיָצַקְתָּ֖ עַל־רֹאשׁ֑וֹ וּמָשַׁחְתָּ֖ אֹתֽוֹ׃,ז',"כ""ט",Exodus,1
וְהִקְטִ֥יר עָלָ֛יו אַהֲרֹ֖ן קְטֹ֣רֶת סַמִּ֑ים בַּבֹּ֣קֶר בַּבֹּ֗קֶר בְּהֵיטִיב֛וֹ אֶת־הַנֵּרֹ֖ת יַקְטִירֶֽנָּה׃,ז',ל',Exodus,3
זֶ֣ה ׀ יִתְּנ֗וּ כׇּל־הָעֹבֵר֙ עַל־הַפְּקֻדִ֔ים מַחֲצִ֥ית הַשֶּׁ֖קֶל בְּשֶׁ֣קֶל הַקֹּ֑דֶשׁ עֶשְׂרִ֤ים גֵּרָה֙ הַשֶּׁ֔קֶל מַחֲצִ֣ית הַשֶּׁ֔קֶל תְּרוּמָ֖ה לַֽיהוָֽה׃,"י""ג",ל',Exodus,7
אִ֚ישׁ אֲשֶׁ֣ר יִרְקַ֣ח כָּמֹ֔הוּ וַאֲשֶׁ֥ר יִתֵּ֛ן מִמֶּ֖נּוּ עַל־זָ֑ר וְנִכְרַ֖ת מֵעַמָּֽיו׃ ס,"ל""ג",ל',Exodus,7
וְהַ֨לֻּחֹ֔ת מַעֲשֵׂ֥ה אֱלֹהִ֖ים הֵ֑מָּה וְהַמִּכְתָּ֗ב מִכְתַּ֤ב אֱלֹהִים֙ ה֔וּא חָר֖וּת עַל־הַלֻּחֹֽת׃,"ט""ז","ל""ב",Exodus,1
וַיֹּ֤אמֶר מֹשֶׁה֙ אֶֽל־אַהֲרֹ֔ן מֶֽה־עָשָׂ֥ה לְךָ֖ הָעָ֣ם הַזֶּ֑ה כִּֽי־הֵבֵ֥אתָ עָלָ֖יו חֲטָאָ֥ה גְדֹלָֽה׃,"כ""א","ל""ב",Exodus,7
וֶהְיֵ֥ה נָכ֖וֹן לַבֹּ֑קֶר וְעָלִ֤יתָ בַבֹּ֨קֶר֙ אֶל־הַ֣ר סִינַ֔י וְנִצַּבְתָּ֥ לִ֛י שָׁ֖ם עַל־רֹ֥אשׁ הָהָֽר׃,ב',"ל""ד",Exodus,1
וְיָצַ֣קְתָּ לּ֗וֹ אַרְבַּע֙ טַבְּעֹ֣ת זָהָ֔ב וְנָ֣תַתָּ֔ה עַ֖ל אַרְבַּ֣ע פַּעֲמֹתָ֑יו וּשְׁתֵּ֣י טַבָּעֹ֗ת עַל־צַלְעוֹ֙ הָֽאֶחָ֔ת וּשְׁתֵּי֙ טַבָּעֹ֔ת עַל־צַלְע֖וֹ הַשֵּׁנִֽית׃,"י""ב","כ""ה",Exodus,1
הִשָּׁ֣מֶר לְךָ֗ פֶּן־תִּכְרֹ֤ת בְּרִית֙ לְיוֹשֵׁ֣ב הָאָ֔רֶץ אֲשֶׁ֥ר אַתָּ֖ה בָּ֣א עָלֶ֑יהָ פֶּן־יִהְיֶ֥ה לְמוֹקֵ֖שׁ בְּקִרְבֶּֽךָ׃,"י""ב","ל""ד",Exodus,11
וְחֵ֨שֶׁב אֲפֻדָּת֜וֹ אֲשֶׁ֣ר עָלָ֗יו מִמֶּ֣נּוּ הוּא֮ כְּמַעֲשֵׂהוּ֒ זָהָ֗ב תְּכֵ֧לֶת וְאַרְגָּמָ֛ן וְתוֹלַ֥עַת שָׁנִ֖י וְשֵׁ֣שׁ מׇשְׁזָ֑ר כַּאֲשֶׁ֛ר צִוָּ֥ה יְהוָ֖ה אֶת־מֹשֶֽׁה׃,ה',"ל""ט",Exodus,11
וְלֹא־יָכֹ֣ל מֹשֶׁ֗ה לָבוֹא֙ אֶל־אֹ֣הֶל מוֹעֵ֔ד כִּֽי־שָׁכַ֥ן עָלָ֖יו הֶעָנָ֑ן וּכְב֣וֹד יְהוָ֔ה מָלֵ֖א אֶת־הַמִּשְׁכָּֽן׃,"ל""ה",מ',Exodus,7
וַיִּקַּ֨ח מֹשֶׁ֜ה אֶת־אִשְׁתּ֣וֹ וְאֶת־בָּנָ֗יו וַיַּרְכִּבֵם֙ עַֽל־הַחֲמֹ֔ר וַיָּ֖שׇׁב אַ֣רְצָה מִצְרָ֑יִם וַיִּקַּ֥ח מֹשֶׁ֛ה אֶת־מַטֵּ֥ה הָאֱלֹהִ֖ים בְּיָדֽוֹ׃,כ',ד',Exodus,1
וַיֹּ֣אמְר֔וּ אֱלֹהֵ֥י הָעִבְרִ֖ים נִקְרָ֣א עָלֵ֑ינוּ נֵ֣לֲכָה נָּ֡א דֶּרֶךְ֩ שְׁלֹ֨שֶׁת יָמִ֜ים בַּמִּדְבָּ֗ר וְנִזְבְּחָה֙ לַֽיהוָ֣ה אֱלֹהֵ֔ינוּ פֶּ֨ן־יִפְגָּעֵ֔נוּ בַּדֶּ֖בֶר א֥וֹ בֶחָֽרֶב׃,ג',ה',Exodus,3
תִּכְבַּ֧ד הָעֲבֹדָ֛ה עַל־הָאֲנָשִׁ֖ים וְיַעֲשׂוּ־בָ֑הּ וְאַל־יִשְׁע֖וּ בְּדִבְרֵי־שָֽׁקֶר׃,ט',ה',Exodus,11
וַיֹּ֛אמֶר נִרְפִּ֥ים אַתֶּ֖ם נִרְפִּ֑ים עַל־כֵּן֙ אַתֶּ֣ם אֹֽמְרִ֔ים נֵלְכָ֖ה נִזְבְּחָ֥ה לַֽיהוָֽה׃,"י""ז",ה',Exodus,7
וַיֹּאמְר֣וּ אֲלֵהֶ֔ם יֵ֧רֶא יְהוָ֛ה עֲלֵיכֶ֖ם וְיִשְׁפֹּ֑ט אֲשֶׁ֧ר הִבְאַשְׁתֶּ֣ם אֶת־רֵיחֵ֗נוּ בְּעֵינֵ֤י פַרְעֹה֙ וּבְעֵינֵ֣י עֲבָדָ֔יו לָֽתֶת־חֶ֥רֶב בְּיָדָ֖ם לְהׇרְגֵֽנוּ׃,"כ""א",ה',Exodus,7
כֹּ֚ה אָמַ֣ר יְהוָ֔ה בְּזֹ֣את תֵּדַ֔ע כִּ֖י אֲנִ֣י יְהוָ֑ה הִנֵּ֨ה אָנֹכִ֜י מַכֶּ֣ה ׀ בַּמַּטֶּ֣ה אֲשֶׁר־בְּיָדִ֗י עַל־הַמַּ֛יִם אֲשֶׁ֥ר בַּיְאֹ֖ר וְנֶהֶפְכ֥וּ לְדָֽם׃,"י""ז",ז',Exodus,1
וַיֹּ֣אמֶר יְהוָה֮ אֶל־מֹשֶׁה֒ אֱמֹ֣ר אֶֽל־אַהֲרֹ֗ן נְטֵ֤ה אֶת־יָדְךָ֙ בְּמַטֶּ֔ךָ עַל־הַ֨נְּהָרֹ֔ת עַל־הַיְאֹרִ֖ים וְעַל־הָאֲגַמִּ֑ים וְהַ֥עַל אֶת־הַֽצְפַרְדְּעִ֖ים עַל־אֶ֥רֶץ מִצְרָֽיִם׃,א',ח',Exodus,1
וַיֵּ֤ט אַהֲרֹן֙ אֶת־יָד֔וֹ עַ֖ל מֵימֵ֣י מִצְרָ֑יִם וַתַּ֨עַל֙ הַצְּפַרְדֵּ֔עַ וַתְּכַ֖ס אֶת־אֶ֥רֶץ מִצְרָֽיִם׃,ב',ח',Exodus,1
וַיֵּצֵ֥א מֹשֶׁ֛ה וְאַהֲרֹ֖ן מֵעִ֣ם פַּרְעֹ֑ה וַיִּצְעַ֤ק מֹשֶׁה֙ אֶל־יְהוָ֔ה עַל־דְּבַ֥ר הַֽצְפַרְדְּעִ֖ים אֲשֶׁר־שָׂ֥ם לְפַרְעֹֽה׃,ח',ח',Exodus,7
וְהָיָ֣ה לְאָבָ֔ק עַ֖ל כׇּל־אֶ֣רֶץ מִצְרָ֑יִם וְהָיָ֨ה עַל־הָאָדָ֜ם וְעַל־הַבְּהֵמָ֗ה לִשְׁחִ֥ין פֹּרֵ֛חַ אֲבַעְבֻּעֹ֖ת בְּכָל־אֶ֥רֶץ מִצְרָֽיִם׃,ט',ט',Exodus,1
וְהָיָה֩ לְךָ֨ לְא֜וֹת עַל־יָדְךָ֗ וּלְזִכָּרוֹן֙ בֵּ֣ין עֵינֶ֔יךָ לְמַ֗עַן תִּהְיֶ֛ה תּוֹרַ֥ת יְהוָ֖ה בְּפִ֑יךָ כִּ֚י בְּיָ֣ד חֲזָקָ֔ה הוֹצִֽאֲךָ֥ יְהֹוָ֖ה מִמִּצְרָֽיִם׃,ט',"י""ג",Exodus,11
דַּבֵּר֮ אֶל־בְּנֵ֣י יִשְׂרָאֵל֒ וְיָשֻׁ֗בוּ וְיַחֲנוּ֙ לִפְנֵי֙ פִּ֣י הַחִירֹ֔ת בֵּ֥ין מִגְדֹּ֖ל וּבֵ֣ין הַיָּ֑ם לִפְנֵי֙ בַּ֣עַל צְפֹ֔ן נִכְח֥וֹ תַחֲנ֖וּ עַל־הַיָּֽם׃,ב',"י""ד",Exodus,1
וַיִּקַּ֗ח שֵׁשׁ־מֵא֥וֹת רֶ֨כֶב֙ בָּח֔וּר וְכֹ֖ל רֶ֣כֶב מִצְרָ֑יִם וְשָׁלִשִׁ֖ם עַל־כֻּלּֽוֹ׃,ז',"י""ד",Exodus,11
וַיּ֨וֹשַׁע יְהוָ֜ה בַּיּ֥וֹם הַה֛וּא אֶת־יִשְׂרָאֵ֖ל מִיַּ֣ד מִצְרָ֑יִם וַיַּ֤רְא יִשְׂרָאֵל֙ אֶת־מִצְרַ֔יִם מֵ֖ת עַל־שְׂפַ֥ת הַיָּֽם׃,ל',"י""ד",Exodus,1
וַיָּבֹ֣אוּ אֵילִ֔מָה וְשָׁ֗ם שְׁתֵּ֥ים עֶשְׂרֵ֛ה עֵינֹ֥ת מַ֖יִם וְשִׁבְעִ֣ים תְּמָרִ֑ים וַיַּחֲנוּ־שָׁ֖ם עַל־הַמָּֽיִם׃,"כ""ז","ט""ו",Exodus,1
וְהָיָה֙ בַּיּ֣וֹם הַשִּׁשִּׁ֔י וְהֵכִ֖ינוּ אֵ֣ת אֲשֶׁר־יָבִ֑יאוּ וְהָיָ֣ה מִשְׁנֶ֔ה עַ֥ל אֲשֶֽׁר־יִלְקְט֖וּ י֥וֹם ׀ יֽוֹם׃ ס,ה',"ט""ז",Exodus,7
(וילינו) [וַיִּלּ֜וֹנוּ] כׇּל־עֲדַ֧ת בְּנֵי־יִשְׂרָאֵ֛ל עַל־מֹשֶׁ֥ה וְעַֽל־אַהֲרֹ֖ן בַּמִּדְבָּֽר׃,ב',"ט""ז",Exodus,11
וְלֹא־שָׁמְע֣וּ אֶל־מֹשֶׁ֗ה וַיּוֹתִ֨רוּ אֲנָשִׁ֤ים מִמֶּ֨נּוּ֙ עַד־בֹּ֔קֶר וַיָּ֥רֻם תּוֹלָעִ֖ים וַיִּבְאַ֑שׁ וַיִּקְצֹ֥ף עֲלֵהֶ֖ם מֹשֶֽׁה׃,כ',"ט""ז",Exodus,11
וַיֹּ֨אמֶר מֹשֶׁ֤ה אֶל־יְהוֹשֻׁ֨עַ֙ בְּחַר־לָ֣נוּ אֲנָשִׁ֔ים וְצֵ֖א הִלָּחֵ֣ם בַּעֲמָלֵ֑ק מָחָ֗ר אָנֹכִ֤י נִצָּב֙ עַל־רֹ֣אשׁ הַגִּבְעָ֔ה וּמַטֵּ֥ה הָאֱלֹהִ֖ים בְּיָדִֽי׃,ט',"י""ז",Exodus,1
וִידֵ֤י מֹשֶׁה֙ כְּבֵדִ֔ים וַיִּקְחוּ־אֶ֛בֶן וַיָּשִׂ֥ימוּ תַחְתָּ֖יו וַיֵּ֣שֶׁב עָלֶ֑יהָ וְאַהֲרֹ֨ן וְח֜וּר תָּֽמְכ֣וּ בְיָדָ֗יו מִזֶּ֤ה אֶחָד֙ וּמִזֶּ֣ה אֶחָ֔ד וַיְהִ֥י יָדָ֛יו אֱמוּנָ֖ה עַד־בֹּ֥א הַשָּֽׁמֶשׁ׃,"י""ב","י""ז",Exodus,1
וַיִּ֣חַדְּ יִתְר֔וֹ עַ֚ל כׇּל־הַטּוֹבָ֔ה אֲשֶׁר־עָשָׂ֥ה יְהוָ֖ה לְיִשְׂרָאֵ֑ל אֲשֶׁ֥ר הִצִּיל֖וֹ מִיַּ֥ד מִצְרָֽיִם׃,ט',"י""ח",Exodus,11
אִ֣ם אֶת־הַדָּבָ֤ר הַזֶּה֙ תַּעֲשֶׂ֔ה וְצִוְּךָ֣ אֱלֹהִ֔ים וְיָֽכׇלְתָּ֖ עֲמֹ֑ד וְגַם֙ כׇּל־הָעָ֣ם הַזֶּ֔ה עַל־מְקֹמ֖וֹ יָבֹ֥א בְשָׁלֽוֹם׃,"כ""ג","י""ח",Exodus,3
וַתֹּ֣אמֶר ל֗וֹ אֲדֹנִי֙ אַתָּ֨ה נִשְׁבַּ֜עְתָּ בַּֽיהוָ֤ה אֱלֹהֶ֨יךָ֙ לַֽאֲמָתֶ֔ךָ כִּֽי־שְׁלֹמֹ֥ה בְנֵ֖ךְ יִמְלֹ֣ךְ אַחֲרָ֑י וְה֖וּא יֵשֵׁ֥ב עַל־כִּסְאִֽי׃,"י""ז",א',I_Kings,1
וְהַיָּמִ֗ים אֲשֶׁ֨ר מָלַ֤ךְ דָּוִד֙ עַל־יִשְׂרָאֵ֔ל אַרְבָּעִ֖ים שָׁנָ֑ה בְּחֶבְר֤וֹן מָלַךְ֙ שֶׁ֣בַע שָׁנִ֔ים וּבִירוּשָׁלִַ֣ם מָלַ֔ךְ שְׁלֹשִׁ֥ים וְשָׁלֹ֖שׁ שָׁנִֽים׃,"י""א",ב',I_Kings,11
וַיֹּ֗אמֶר אַ֤תְּ יָדַ֨עַתְּ֙ כִּי־לִי֙ הָיְתָ֣ה הַמְּלוּכָ֔ה וְעָלַ֞י שָׂ֧מוּ כׇֽל־יִשְׂרָאֵ֛ל פְּנֵיהֶ֖ם לִמְלֹ֑ךְ וַתִּסֹּ֤ב הַמְּלוּכָה֙ וַתְּהִ֣י לְאָחִ֔י כִּ֥י מֵיְהוָ֖ה הָ֥יְתָה לּֽוֹ׃,"ט""ו",ב',I_Kings,3
וַיְדַבֵּר֮ עַל־הָֽעֵצִים֒ מִן־הָאֶ֨רֶז֙ אֲשֶׁ֣ר בַּלְּבָנ֔וֹן וְעַד֙ הָאֵז֔וֹב אֲשֶׁ֥ר יֹצֵ֖א בַּקִּ֑יר וַיְדַבֵּר֙ עַל־הַבְּהֵמָ֣ה וְעַל־הָע֔וֹף וְעַל־הָרֶ֖מֶשׂ וְעַל־הַדָּגִֽים׃,"י""ג",ה',I_Kings,other
יְהוּדָ֤ה וְיִשְׂרָאֵל֙ רַבִּ֔ים כַּח֥וֹל אֲשֶׁר־עַל־הַיָּ֖ם לָרֹ֑ב אֹכְלִ֥ים וְשֹׁתִ֖ים וּשְׂמֵחִֽים׃,כ,ד',I_Kings,2
וּמַדּ֕וּעַ לֹ֣א שָׁמַ֔רְתָּ אֵ֖ת שְׁבֻעַ֣ת יְהוָ֑ה וְאֶת־הַמִּצְוָ֖ה אֲשֶׁר־צִוִּ֥יתִי עָלֶֽיךָ׃,"מ""ג",ב',I_Kings,11
וְהִנְנִ֣י אֹמֵ֔ר לִבְנ֣וֹת בַּ֔יִת לְשֵׁ֖ם יְהוָ֣ה אֱלֹהָ֑י כַּאֲשֶׁ֣ר ׀ דִּבֶּ֣ר יְהוָ֗ה אֶל־דָּוִ֤ד אָבִי֙ לֵאמֹ֔ר בִּנְךָ֗ אֲשֶׁ֨ר אֶתֵּ֤ן תַּחְתֶּ֨יךָ֙ עַל־כִּסְאֶ֔ךָ הֽוּא־יִבְנֶ֥ה הַבַּ֖יִת לִשְׁמִֽי׃,"י""ט",ה',I_Kings,1
וַיִּשְׁלָחֵ֣ם לְבָנ֗וֹנָה עֲשֶׂ֨רֶת אֲלָפִ֤ים בַּחֹ֨דֶשׁ֙ חֲלִיפ֔וֹת חֹ֚דֶשׁ יִהְי֣וּ בַלְּבָנ֔וֹן שְׁנַ֥יִם חֳדָשִׁ֖ים בְּבֵית֑וֹ וַאֲדֹנִירָ֖ם עַל־הַמַּֽס׃,"כ""ח",ה',I_Kings,7
וְכֹֽתָרֹ֗ת אֲשֶׁר֙ עַל־רֹ֣אשׁ הָעַמּוּדִ֔ים מַעֲשֵׂ֖ה שׁוּשַׁ֣ן בָּֽאוּלָ֑ם אַרְבַּ֖ע אַמּֽוֹת׃,"י""ט",ז',I_Kings,1
כִּ֚י הַֽאֻמְנָ֔ם יֵשֵׁ֥ב אֱלֹהִ֖ים עַל־הָאָ֑רֶץ הִ֠נֵּה הַשָּׁמַ֜יִם וּשְׁמֵ֤י הַשָּׁמַ֨יִם֙ לֹ֣א יְכַלְכְּל֔וּךָ אַ֕ף כִּֽי־הַבַּ֥יִת הַזֶּ֖ה אֲשֶׁ֥ר בָּנִֽיתִי׃,"כ""ז",ח',I_Kings,1
וַתֹּ֨אמֶר֙ אֶל־הַמֶּ֔לֶךְ אֱמֶת֙ הָיָ֣ה הַדָּבָ֔ר אֲשֶׁ֥ר שָׁמַ֖עְתִּי בְּאַרְצִ֑י עַל־דְּבָרֶ֖יךָ וְעַל־חׇכְמָתֶֽךָ׃,ו',י',I_Kings,7
וַיִּתְפֹּ֣שׂ אֲחִיָּ֔ה בַּשַּׂלְמָ֥ה הַחֲדָשָׁ֖ה אֲשֶׁ֣ר עָלָ֑יו וַיִּ֨קְרָעֶ֔הָ שְׁנֵ֥ים עָשָׂ֖ר קְרָעִֽים׃,ל',"י""א",I_Kings,11
וְאֹתְךָ֣ אֶקַּ֔ח וּמָ֣לַכְתָּ֔ בְּכֹ֥ל אֲשֶׁר־תְּאַוֶּ֖ה נַפְשֶׁ֑ךָ וְהָיִ֥יתָ מֶּ֖לֶךְ עַל־יִשְׂרָאֵֽל׃,"ל""ז","י""א",I_Kings,1
וְיֶ֨תֶר דִּבְרֵ֧י שְׁלֹמֹ֛ה וְכׇל־אֲשֶׁ֥ר עָשָׂ֖ה וְחׇכְמָת֑וֹ הֲלֽוֹא־הֵ֣ם כְּתֻבִ֔ים עַל־סֵ֖פֶר דִּבְרֵ֥י שְׁלֹמֹֽה׃,"מ""א","י""א",I_Kings,11
וַיִּבְנ֨וּ גַם־הֵ֧מָּה לָהֶ֛ם בָּמ֥וֹת וּמַצֵּב֖וֹת וַאֲשֵׁרִ֑ים עַ֚ל כׇּל־גִּבְעָ֣ה גְבֹהָ֔ה וְתַ֖חַת כׇּל־עֵ֥ץ רַעֲנָֽן׃,"כ""ג","י""ד",I_Kings,1
וַיְהִ֛י בַּשָּׁנָ֥ה הַחֲמִישִׁ֖ית לַמֶּ֣לֶךְ רְחַבְעָ֑ם עָלָ֛ה (שושק) [שִׁישַׁ֥ק] מֶֽלֶךְ־מִצְרַ֖יִם עַל־יְרוּשָׁלִָֽם׃,"כ""ה","י""ד",I_Kings,3
וַיַּ֨עַשׂ הַמֶּ֤לֶךְ רְחַבְעָם֙ תַּחְתָּ֔ם מָגִנֵּ֖י נְחֹ֑שֶׁת וְהִפְקִ֗יד עַל־יַד֙ שָׂרֵ֣י הָרָצִ֔ים הַשֹּׁ֣מְרִ֔ים פֶּ֖תַח בֵּ֥ית הַמֶּֽלֶךְ׃,"כ""ז","י""ד",I_Kings,3
וְיֶ֛תֶר דִּבְרֵ֥י רְחַבְעָ֖ם וְכׇל־אֲשֶׁ֣ר עָשָׂ֑ה הֲלֹא־הֵ֣מָּה כְתוּבִ֗ים עַל־סֵ֛פֶר דִּבְרֵ֥י הַיָּמִ֖ים לְמַלְכֵ֥י יְהוּדָֽה׃,"כ""ט","י""ד",I_Kings,11
וּבִשְׁנַת֙ שְׁמֹנֶ֣ה עֶשְׂרֵ֔ה לַמֶּ֖לֶךְ יָרׇבְעָ֣ם בֶּן־נְבָ֑ט מָלַ֥ךְ אֲבִיָּ֖ם עַל־יְהוּדָֽה׃,א',"ט""ו",I_Kings,3
עַל־חַטֹּ֤אות יָרׇבְעָם֙ אֲשֶׁ֣ר חָטָ֔א וַאֲשֶׁ֥ר הֶחֱטִ֖יא אֶת־יִשְׂרָאֵ֑ל בְּכַעְס֕וֹ אֲשֶׁ֣ר הִכְעִ֔יס אֶת־יְהוָ֖ה אֱלֹהֵ֥י יִשְׂרָאֵֽל׃,ל',"ט""ו",I_Kings,7
בִּשְׁנַ֨ת עֶשְׂרִ֤ים וָשֵׁשׁ֙ שָׁנָ֔ה לְאָסָ֖א מֶ֣לֶךְ יְהוּדָ֑ה מָ֠לַךְ אֵלָ֨ה בֶן־בַּעְשָׁ֧א עַל־יִשְׂרָאֵ֛ל בְּתִרְצָ֖ה שְׁנָתָֽיִם׃,ח',"ט""ז",I_Kings,3
וַיְהִ֨י בְמׇלְכ֜וֹ כְּשִׁבְתּ֣וֹ עַל־כִּסְא֗וֹ הִכָּה֙ אֶת־כׇּל־בֵּ֣ית בַּעְשָׁ֔א לֹֽא־הִשְׁאִ֥יר ל֖וֹ מַשְׁתִּ֣ין בְּקִ֑יר וְגֹאֲלָ֖יו וְרֵעֵֽהוּ׃,"י""א","ט""ז",I_Kings,1
וַיֹּ֥אמֶר אֵלֶ֖יהָ תְּנִֽי־לִ֣י אֶת־בְּנֵ֑ךְ וַיִּקָּחֵ֣הוּ מֵחֵיקָ֗הּ וַֽיַּעֲלֵ֨הוּ֙ אֶל־הָעֲלִיָּ֗ה אֲשֶׁר־הוּא֙ יֹשֵׁ֣ב שָׁ֔ם וַיַּשְׁכִּבֵ֖הוּ עַל־מִטָּתֽוֹ׃,"י""ט","י""ז",I_Kings,3
וַיִּקְרָ֥א אֶל־יְהוָ֖ה וַיֹּאמַ֑ר יְהוָ֣ה אֱלֹהָ֔י הֲ֠גַם עַל־הָאַלְמָנָ֞ה אֲשֶׁר־אֲנִ֨י מִתְגּוֹרֵ֥ר עִמָּ֛הּ הֲרֵע֖וֹתָ לְהָמִ֥ית אֶת־בְּנָֽהּ׃,כ',"י""ז",I_Kings,other
וַֽיִּקְרְאוּ֙ בְּק֣וֹל גָּד֔וֹל וַיִּתְגֹּֽדְדוּ֙ כְּמִשְׁפָּטָ֔ם בַּחֲרָב֖וֹת וּבָֽרְמָחִ֑ים עַד־שְׁפׇךְ־דָּ֖ם עֲלֵיהֶֽם׃,"כ""ח","י""ח",I_Kings,11
וַיִּגַּ֨שׁ אֵלִיָּ֜הוּ אֶל־כׇּל־הָעָ֗ם וַיֹּ֨אמֶר֙ עַד־מָתַ֞י אַתֶּ֣ם פֹּסְחִים֮ עַל־שְׁתֵּ֣י הַסְּעִפִּים֒ אִם־יְהוָ֤ה הָֽאֱלֹהִים֙ לְכ֣וּ אַחֲרָ֔יו וְאִם־הַבַּ֖עַל לְכ֣וּ אַחֲרָ֑יו וְלֹֽא־עָנ֥וּ הָעָ֛ם אֹת֖וֹ דָּבָֽר׃,"כ""א","י""ח",I_Kings,11
וַיַּרְא֙ כׇּל־הָעָ֔ם וַֽיִּפְּל֖וּ עַל־פְּנֵיהֶ֑ם וַיֹּ֣אמְר֔וּ יְהוָה֙ ה֣וּא הָאֱלֹהִ֔ים יְהוָ֖ה ה֥וּא הָאֱלֹהִֽים׃,"ל""ט","י""ח ",I_Kings,11
וַיֹּ֤אמֶר יְהוָה֙ אֵלָ֔יו לֵ֛ךְ שׁ֥וּב לְדַרְכְּךָ֖ מִדְבַּ֣רָה דַמָּ֑שֶׂק וּבָ֗אתָ וּמָשַׁחְתָּ֧ אֶת־חֲזָאֵ֛ל לְמֶ֖לֶךְ עַל־אֲרָֽם׃,"ט""ו","י""ט",I_Kings,11
וַיַּכּוּ֙ אִ֣ישׁ אִישׁ֔וֹ וַיָּנֻ֣סוּ אֲרָ֔ם וַֽיִּרְדְּפֵ֖ם יִשְׂרָאֵ֑ל וַיִּמָּלֵ֗ט בֶּן־הֲדַד֙ מֶ֣לֶךְ אֲרָ֔ם עַל־ס֖וּס וּפָרָשִֽׁים׃,כ',כ',I_Kings,1
וַיָּנֻ֨סוּ הַנּוֹתָרִ֥ים ׀ אֲפֵקָה֮ אֶל־הָעִיר֒ וַתִּפֹּל֙ הַחוֹמָ֔ה עַל־עֶשְׂרִ֨ים וְשִׁבְעָ֥ה אֶ֛לֶף אִ֖ישׁ הַנּוֹתָרִ֑ים וּבֶן־הֲדַ֣ד נָ֔ס וַיָּבֹ֥א אֶל־הָעִ֖יר חֶ֥דֶר בְּחָֽדֶר׃ ס,ל',כ',I_Kings,1
וְהָאֲנָשִׁים֩ יְנַחֲשׁ֨וּ וַֽיְמַהֲר֜וּ וַיַּחְלְט֣וּ הֲמִמֶּ֗נּוּ וַיֹּֽאמְרוּ֙ אָחִ֣יךָ בֶן־הֲדַ֔ד וַיֹּ֖אמֶר בֹּ֣אוּ קָחֻ֑הוּ וַיֵּצֵ֤א אֵלָיו֙ בֶּן־הֲדַ֔ד וַֽיַּעֲלֵ֖הוּ עַל־הַמֶּרְכָּבָֽה׃,"ל""ג",כ',I_Kings,1
וַיֵּ֧לֶךְ מֶֽלֶךְ־יִשְׂרָאֵ֛ל עַל־בֵּית֖וֹ סַ֣ר וְזָעֵ֑ף וַיָּבֹ֖א שֹׁמְרֽוֹנָה׃ פ,"מ""ג",כ',I_Kings,3
וַתֹּ֤אמֶר אֵלָיו֙ אִיזֶ֣בֶל אִשְׁתּ֔וֹ אַתָּ֕ה עַתָּ֛ה תַּעֲשֶׂ֥ה מְלוּכָ֖ה עַל־יִשְׂרָאֵ֑ל ק֤וּם אֱכׇל־לֶ֨חֶם֙ וְיִטַ֣ב לִבֶּ֔ךָ אֲנִי֙ אֶתֵּ֣ן לְךָ֔ אֶת־כֶּ֖רֶם נָב֥וֹת הַיִּזְרְעֵאלִֽי׃,ז',"כ""א",I_Kings,1
וַיְהִי֩ כִשְׁמֹ֨עַ אַחְאָ֜ב אֶת־הַדְּבָרִ֤ים הָאֵ֨לֶּה֙ וַיִּקְרַ֣ע בְּגָדָ֔יו וַיָּֽשֶׂם־שַׂ֥ק עַל־בְּשָׂר֖וֹ וַיָּצ֑וֹם וַיִּשְׁכַּ֣ב בַּשָּׂ֔ק וַיְהַלֵּ֖ךְ אַֽט׃ ס,"כ""ז","כ""א",I_Kings,1
וּמֶ֣לֶךְ יִשְׂרָאֵ֡ל וִֽיהוֹשָׁפָ֣ט מֶֽלֶךְ־יְהוּדָ֡ה יֹשְׁבִים֩ אִ֨ישׁ עַל־כִּסְא֜וֹ מְלֻבָּשִׁ֤ים בְּגָדִים֙ בְּגֹ֔רֶן פֶּ֖תַח שַׁ֣עַר שֹׁמְר֑וֹן וְכׇ֨ל־הַנְּבִיאִ֔ים מִֽתְנַבְּאִ֖ים לִפְנֵיהֶֽם׃,י',"כ""ב",I_Kings,1
וְיֶ֨תֶר דִּבְרֵ֧י יְהוֹשָׁפָ֛ט וּגְבוּרָת֥וֹ אֲשֶׁר־עָשָׂ֖ה וַאֲשֶׁ֣ר נִלְחָ֑ם הֲלֹֽא־הֵ֣ם כְּתוּבִ֗ים עַל־סֵ֛פֶר דִּבְרֵ֥י הַיָּמִ֖ים לְמַלְכֵ֥י יְהוּדָֽה׃,"מ""ו","כ""ב",I_Kings,11
וִיהֽוֹשָׁפָט֙ בֶּן־אָסָ֔א מָלַ֖ךְ עַל־יְהוּדָ֑ה בִּשְׁנַ֣ת אַרְבַּ֔ע לְאַחְאָ֖ב מֶ֥לֶךְ יִשְׂרָאֵֽל׃,"מ""א","כ""ב",I_Kings,1
וְעַתָּ֗ה הִנֵּ֨ה נָתַ֤ן יְהוָה֙ ר֣וּחַ שֶׁ֔קֶר בְּפִ֖י כׇּל־נְבִיאֶ֣יךָ אֵ֑לֶּה וַֽיהוָ֔ה דִּבֶּ֥ר עָלֶ֖יךָ רָעָֽה׃,"כ""ג","כ""ב",I_Kings,11
וַיְהִ֡י כִּרְאוֹת֩ שָׂרֵ֨י הָרֶ֜כֶב אֶת־יְהוֹשָׁפָ֗ט וְהֵ֤מָּה אָֽמְרוּ֙ אַ֣ךְ מֶֽלֶךְ־יִשְׂרָאֵ֣ל ה֔וּא וַיָּסֻ֥רוּ עָלָ֖יו לְהִלָּחֵ֑ם וַיִּזְעַ֖ק יְהוֹשָׁפָֽט׃,"ל""ב","כ""ב",I_Kings,11
וַיִּגַּשׁ֙ צִדְקִיָּ֣הוּ בֶֽן־כְּנַעֲנָ֔ה וַיַּכֶּ֥ה אֶת־מִיכָ֖יְהוּ עַל־הַלֶּ֑חִי וַיֹּ֕אמֶר אֵי־זֶ֨ה עָבַ֧ר רֽוּחַ־יְהוָ֛ה מֵאִתִּ֖י לְדַבֵּ֥ר אוֹתָֽךְ׃,"כ""ד","כ""ב",I_Kings,1
וְֽהָיָ֗ה כְּעֵץ֮ שָׁת֪וּל עַֽל־פַּלְגֵ֫י מָ֥יִם אֲשֶׁ֤ר פִּרְי֨וֹ ׀ יִתֵּ֬ן בְּעִתּ֗וֹ וְעָלֵ֥הוּ לֹֽא־יִבּ֑וֹל וְכֹ֖ל אֲשֶׁר־יַעֲשֶׂ֣ה יַצְלִֽיחַ׃,ג',א',Psalms,2
