הפסוק,פסוק,פרק,ספר,משמעות
י֥וֹם שׁוֹפָ֖ר וּתְרוּעָ֑ה עַ֚ל הֶעָרִ֣ים הַבְּצֻר֔וֹת וְעַ֖ל הַפִּנּ֥וֹת הַגְּבֹהֽוֹת׃,"ט""ז",א',Zephaniah,1
בְּטֶ֨רֶם֙ לֶ֣דֶת חֹ֔ק כְּמֹ֖ץ עָ֣בַר י֑וֹם בְּטֶ֣רֶם ׀ לֹא־יָב֣וֹא עֲלֵיכֶ֗ם חֲרוֹן֙ אַף־יְהוָ֔ה בְּטֶ֨רֶם֙ לֹא־יָב֣וֹא עֲלֵיכֶ֔ם י֖וֹם אַף־יְהוָֽה׃,ב',ב',Zephaniah,11
ה֗וֹי יֹֽשְׁבֵ֛י חֶ֥בֶל הַיָּ֖ם גּ֣וֹי כְּרֵתִ֑ים דְּבַר־יְהוָ֣ה עֲלֵיכֶ֗ם כְּנַ֨עַן֙ אֶ֣רֶץ פְּלִשְׁתִּ֔ים וְהַאֲבַדְתִּ֖יךְ מֵאֵ֥ין יוֹשֵֽׁב׃,ה',ב',Zephaniah,11
שָׁמַ֨עְתִּי֙ חֶרְפַּ֣ת מוֹאָ֔ב וְגִדּוּפֵ֖י בְּנֵ֣י עַמּ֑וֹן אֲשֶׁ֤ר חֵֽרְפוּ֙ אֶת־עַמִּ֔י וַיַּגְדִּ֖ילוּ עַל־גְּבוּלָֽם׃,ח',ב',Zephaniah,11
זֹ֥את לָהֶ֖ם תַּ֣חַת גְּאוֹנָ֑ם כִּ֤י חֵֽרְפוּ֙ וַיַּגְדִּ֔לוּ עַל־עַ֖ם יְהוָ֥ה צְבָאֽוֹת׃,י',ב',Zephaniah,11
נוּגֵ֧י מִמּוֹעֵ֛ד אָסַ֖פְתִּי מִמֵּ֣ךְ הָי֑וּ מַשְׂאֵ֥ת עָלֶ֖יהָ חֶרְפָּֽה׃,"י""ח",ג',Zephaniah,11
יְהוָ֧ה אֱלֹהַ֛יִךְ בְּקִרְבֵּ֖ךְ גִּבּ֣וֹר יוֹשִׁ֑יעַ יָשִׂ֨ישׂ עָלַ֜יִךְ בְּשִׂמְחָ֗ה יַחֲרִישׁ֙ בְּאַ֣הֲבָת֔וֹ יָגִ֥יל עָלַ֖יִךְ בְּרִנָּֽה׃,"י""ז",ג',Zephaniah,11
לָכֵ֤ן חַכּוּ־לִי֙ נְאֻם־יְהוָ֔ה לְי֖וֹם קוּמִ֣י לְעַ֑ד כִּ֣י מִשְׁפָּטִי֩ לֶאֱסֹ֨ף גּוֹיִ֜ם לְקׇבְצִ֣י מַמְלָכ֗וֹת לִשְׁפֹּ֨ךְ עֲלֵיהֶ֤ם זַעְמִי֙ כֹּ֚ל חֲר֣וֹן אַפִּ֔י כִּ֚י בְּאֵ֣שׁ קִנְאָתִ֔י תֵּאָכֵ֖ל כׇּל־הָאָֽרֶץ׃,ח',ג',Zephaniah,11
אָמַ֜רְתִּי אַךְ־תִּירְאִ֤י אוֹתִי֙ תִּקְחִ֣י מוּסָ֔ר וְלֹֽא־יִכָּרֵ֣ת מְעוֹנָ֔הּ כֹּ֥ל אֲשֶׁר־פָּקַ֖דְתִּי עָלֶ֑יהָ אָכֵן֙ הִשְׁכִּ֣ימוּ הִשְׁחִ֔יתוּ כֹּ֖ל עֲלִילוֹתָֽם׃,ז',ג',Zephaniah,11
וְיֵ֤ט יָדוֹ֙ עַל־צָפ֔וֹן וִֽיאַבֵּ֖ד אֶת־אַשּׁ֑וּר וְיָשֵׂ֤ם אֶת־נִֽינְוֵה֙ לִשְׁמָמָ֔ה צִיָּ֖ה כַּמִּדְבָּֽר׃,"י""ג",ב',Zephaniah,3
כִּ֣י יִקָּרֵ֣א קַן־צִפּ֣וֹר ׀ לְפָנֶ֡יךָ בַּדֶּ֜רֶךְ בְּכׇל־עֵ֣ץ ׀ א֣וֹ עַל־הָאָ֗רֶץ אֶפְרֹחִים֙ א֣וֹ בֵיצִ֔ים וְהָאֵ֤ם רֹבֶ֨צֶת֙ עַל־הָֽאֶפְרֹחִ֔ים א֖וֹ עַל־הַבֵּיצִ֑ים לֹא־תִקַּ֥ח הָאֵ֖ם עַל־הַבָּנִֽים׃,ו,כב,Deuteronomy,1
כְּנֶ֨שֶׁר֙ יָעִ֣יר קִנּ֔וֹ עַל־גּוֹזָלָ֖יו יְרַחֵ֑ף יִפְרֹ֤שׂ כְּנָפָיו֙ יִקָּחֵ֔הוּ יִשָּׂאֵ֖הוּ עַל־אֶבְרָתֽוֹ׃,יא,לב,Deuteronomy,2
וְאֶכְתֹּב֙ עַל־הַלֻּחֹ֔ת אֶת־הַדְּבָרִ֔ים אֲשֶׁ֥ר הָי֛וּ עַל־הַלֻּחֹ֥ת הָרִאשֹׁנִ֖ים אֲשֶׁ֣ר שִׁבַּ֑רְתָּ וְשַׂמְתָּ֖ם בָּאָרֽוֹן׃,ב,י,Deuteronomy,1
לֹֽא־יוּמְת֤וּ אָבוֹת֙ עַל־בָּנִ֔ים וּבָנִ֖ים לֹא־יוּמְת֣וּ עַל־אָב֑וֹת אִ֥ישׁ בְּחֶטְא֖וֹ יוּמָֽתוּ׃ ס,טז,כד,Deuteronomy,11
עַל־פִּ֣י ׀ שְׁנַ֣יִם עֵדִ֗ים א֛וֹ שְׁלֹשָׁ֥ה עֵדִ֖ים יוּמַ֣ת הַמֵּ֑ת לֹ֣א יוּמַ֔ת עַל־פִּ֖י עֵ֥ד אֶחָֽד׃,ו,יז,Deuteronomy,11
וְהָיָ֣ה כְשִׁבְתּ֔וֹ עַ֖ל כִּסֵּ֣א מַמְלַכְתּ֑וֹ וְכָ֨תַב ל֜וֹ אֶת־מִשְׁנֵ֨ה הַתּוֹרָ֤ה הַזֹּאת֙ עַל־סֵ֔פֶר מִלִּפְנֵ֥י הַכֹּהֲנִ֖ים הַלְוִיִּֽם׃,ח,יז,Deuteronomy,1
וְשַׂמְתֶּם֙ אֶת־דְּבָרַ֣י אֵ֔לֶּה עַל־לְבַבְכֶ֖ם וְעַֽל־נַפְשְׁכֶ֑ם וּקְשַׁרְתֶּ֨ם אֹתָ֤ם לְאוֹת֙ עַל־יֶדְכֶ֔ם וְהָי֥וּ לְטוֹטָפֹ֖ת בֵּ֥ין עֵינֵיכֶֽם׃,יח,יא,Deuteronomy,2
וְעָשִׂ֤יתָ עֹלֹתֶ֨יךָ֙ הַבָּשָׂ֣ר וְהַדָּ֔ם עַל־מִזְבַּ֖ח יְהוָ֣ה אֱלֹהֶ֑יךָ וְדַם־זְבָחֶ֗יךָ יִשָּׁפֵךְ֙ עַל־מִזְבַּח֙ יְהוָ֣ה אֱלֹהֶ֔יךָ וְהַבָּשָׂ֖ר תֹּאכֵֽל׃,כז,יב,Deuteronomy,1
לְמַ֨עַן יִרְבּ֤וּ יְמֵיכֶם֙ וִימֵ֣י בְנֵיכֶ֔ם עַ֚ל הָֽאֲדָמָ֔ה אֲשֶׁ֨ר נִשְׁבַּ֧ע יְהוָ֛ה לַאֲבֹתֵיכֶ֖ם לָתֵ֣ת לָהֶ֑ם כִּימֵ֥י הַשָּׁמַ֖יִם עַל־הָאָֽרֶץ׃,כא,יא,Deuteronomy,1
וְעָבַדְתָּ֣ אֶת־אֹיְבֶ֗יךָ אֲשֶׁ֨ר יְשַׁלְּחֶ֤נּוּ יְהוָה֙ בָּ֔ךְ בְּרָעָ֧ב וּבְצָמָ֛א וּבְעֵירֹ֖ם וּבְחֹ֣סֶר כֹּ֑ל וְנָתַ֞ן עֹ֤ל בַּרְזֶל֙ עַל־צַוָּארֶ֔ךָ עַ֥ד הִשְׁמִיד֖וֹ אֹתָֽךְ׃,מח,כח,Deuteronomy,1
עַל֩ אֲשֶׁ֨ר מְעַלְתֶּ֜ם בִּ֗י בְּתוֹךְ֙ בְּנֵ֣י יִשְׂרָאֵ֔ל בְּמֵֽי־מְרִיבַ֥ת קָדֵ֖שׁ מִדְבַּר־צִ֑ן עַ֣ל אֲשֶׁ֤ר לֹֽא־קִדַּשְׁתֶּם֙ אוֹתִ֔י בְּת֖וֹךְ בְּנֵ֥י יִשְׂרָאֵֽל׃,נא,לב,Deuteronomy,7
וְהָיָ֗ה כִּ֤י יְבִֽיאֲךָ֙ יְהוָ֣ה אֱלֹהֶ֔יךָ אֶל־הָאָ֕רֶץ אֲשֶׁר־אַתָּ֥ה בָא־שָׁ֖מָּה לְרִשְׁתָּ֑הּ וְנָתַתָּ֤ה אֶת־הַבְּרָכָה֙ עַל־הַ֣ר גְּרִזִ֔ים וְאֶת־הַקְּלָלָ֖ה עַל־הַ֥ר עֵיבָֽל׃,כט,יא,Deuteronomy,1
לֹֽא־יָקוּם֩ עֵ֨ד אֶחָ֜ד בְּאִ֗ישׁ לְכׇל־עָוֹן֙ וּלְכׇל־חַטָּ֔את בְּכׇל־חֵ֖טְא אֲשֶׁ֣ר יֶֽחֱטָ֑א עַל־פִּ֣י ׀ שְׁנֵ֣י עֵדִ֗ים א֛וֹ עַל־פִּ֥י שְׁלֹשָֽׁה־עֵדִ֖ים יָק֥וּם דָּבָֽר׃,טו,יט,Deuteronomy,11
וּכְתַבְתָּ֛ם עַל־מְזוּז֥וֹת בֵּיתֶ֖ךָ וּבִשְׁעָרֶֽיךָ׃,כ,יא,Deuteronomy,1
וַֽיְעַנְּךָ֮ וַיַּרְעִבֶךָ֒ וַיַּֽאֲכִֽלְךָ֤ אֶת־הַמָּן֙ אֲשֶׁ֣ר לֹא־יָדַ֔עְתָּ וְלֹ֥א יָדְע֖וּן אֲבֹתֶ֑יךָ לְמַ֣עַן הוֹדִֽעֲךָ֗ כִּ֠י לֹ֣א עַל־הַלֶּ֤חֶם לְבַדּוֹ֙ יִחְיֶ֣ה הָֽאָדָ֔ם כִּ֛י עַל־כׇּל־מוֹצָ֥א פִֽי־יְהוָ֖ה יִחְיֶ֥ה הָאָדָֽם׃,ג,ח,Deuteronomy,11
לֹא־תִשְׁתַּחֲוֶ֥֣ה לָהֶ֖ם֮ וְלֹ֣א תָעׇבְדֵ֑ם֒ כִּ֣י אָנֹכִ֞י יְהוָ֤ה אֱלֹהֶ֨יךָ֙ אֵ֣ל קַנָּ֔א פֹּ֠קֵד עֲוֹ֨ן אָב֧וֹת עַל־בָּנִ֛ים וְעַל־שִׁלֵּשִׁ֥ים וְעַל־רִבֵּעִ֖ים לְשֹׂנְאָֽ֑י׃,ט,ה,Deuteronomy,11
שׂ֣וֹם תָּשִׂ֤ים עָלֶ֨יךָ֙ מֶ֔לֶךְ אֲשֶׁ֥ר יִבְחַ֛ר יְהוָ֥ה אֱלֹהֶ֖יךָ בּ֑וֹ מִקֶּ֣רֶב אַחֶ֗יךָ תָּשִׂ֤ים עָלֶ֨יךָ֙ מֶ֔לֶךְ לֹ֣א תוּכַ֗ל לָתֵ֤ת עָלֶ֨יךָ֙ אִ֣ישׁ נׇכְרִ֔י אֲשֶׁ֥ר לֹֽא־אָחִ֖יךָ הֽוּא׃,טו,יז,Deuteronomy,11
וְ֠הָיָה כַּאֲשֶׁר־שָׂ֨שׂ יְהוָ֜ה עֲלֵיכֶ֗ם לְהֵיטִ֣יב אֶתְכֶם֮ וּלְהַרְבּ֣וֹת אֶתְכֶם֒ כֵּ֣ן יָשִׂ֤ישׂ יְהוָה֙ עֲלֵיכֶ֔ם לְהַאֲבִ֥יד אֶתְכֶ֖ם וּלְהַשְׁמִ֣יד אֶתְכֶ֑ם וְנִסַּחְתֶּם֙ מֵעַ֣ל הָֽאֲדָמָ֔ה אֲשֶׁר־אַתָּ֥ה בָא־שָׁ֖מָּה לְרִשְׁתָּֽהּ׃,סג,כח,Deuteronomy,11
וּכְתַבְתָּ֛ם עַל־מְזוּזֹ֥ת בֵּיתֶ֖ךָ וּבִשְׁעָרֶֽיךָ׃ ס,ט,ו,Deuteronomy,1
לֹ֖א תֹּאכְלֶ֑נּוּ עַל־הָאָ֥רֶץ תִּשְׁפְּכֶ֖נּוּ כַּמָּֽיִם׃,כד,יב,Deuteronomy,1
לֹ֣א יִהְיֶ֥ה־לְךָ֛֩ אֱלֹהִ֥֨ים אֲחֵרִ֖֜ים עַל־פָּנָֽ֗י׃,ז,ה,Deuteronomy,11
וְהוֹצֵאתֶ֨ם אֶת־שְׁנֵיהֶ֜ם אֶל־שַׁ֣עַר ׀ הָעִ֣יר הַהִ֗וא וּסְקַלְתֶּ֨ם אֹתָ֥ם בָּאֲבָנִים֮ וָמֵתוּ֒ אֶת־(הנער) [הַֽנַּעֲרָ֗ה] עַל־דְּבַר֙ אֲשֶׁ֣ר לֹא־צָעֲקָ֣ה בָעִ֔יר וְאֶ֨ת־הָאִ֔ישׁ עַל־דְּבַ֥ר אֲשֶׁר־עִנָּ֖ה אֶת־אֵ֣שֶׁת רֵעֵ֑הוּ וּבִֽעַרְתָּ֥ הָרָ֖ע מִקִּרְבֶּֽךָ׃ ס,כד,כב,Deuteronomy,7
וּקְשַׁרְתָּ֥ם לְא֖וֹת עַל־יָדֶ֑ךָ וְהָי֥וּ לְטֹטָפֹ֖ת בֵּ֥ין עֵינֶֽיךָ׃,ח,ו,Deuteronomy,1
רַ֥ק הַדָּ֖ם לֹ֣א תֹאכֵ֑לוּ עַל־הָאָ֥רֶץ תִּשְׁפְּכֶ֖נּוּ כַּמָּֽיִם׃,טז,יב,Deuteronomy,1
חֵ֥לֶק כְּחֵ֖לֶק יֹאכֵ֑לוּ לְבַ֥ד מִמְכָּרָ֖יו עַל־הָאָבֽוֹת׃ ס,ח,יח,Deuteronomy,11
יַעֲרֹ֤ף כַּמָּטָר֙ לִקְחִ֔י תִּזַּ֥ל כַּטַּ֖ל אִמְרָתִ֑י כִּשְׂעִירִ֣ם עֲלֵי־דֶ֔שֶׁא וְכִרְבִיבִ֖ים עֲלֵי־עֵֽשֶׂב׃,ב,לב,Deuteronomy,1
וְנָתַן֙ יְהוָ֣ה אֱלֹהֶ֔יךָ אֵ֥ת כׇּל־הָאָל֖וֹת הָאֵ֑לֶּה עַל־אֹיְבֶ֥יךָ וְעַל־שֹׂנְאֶ֖יךָ אֲשֶׁ֥ר רְדָפֽוּךָ׃,ז,ל,Deuteronomy,11
וְהָי֞וּ הַדְּבָרִ֣ים הָאֵ֗לֶּה אֲשֶׁ֨ר אָנֹכִ֧י מְצַוְּךָ֛ הַיּ֖וֹם עַל־לְבָבֶֽךָ׃,ו,ו,Deuteronomy,2
כִּֽי־תֵצֵ֥א מַחֲנֶ֖ה עַל־אֹיְבֶ֑יךָ וְנִ֨שְׁמַרְתָּ֔ מִכֹּ֖ל דָּבָ֥ר רָֽע׃,י,כג,Deuteronomy,11
וָאוֹלֵ֥ךְ אֶתְכֶ֛ם אַרְבָּעִ֥ים שָׁנָ֖ה בַּמִּדְבָּ֑ר לֹֽא־בָל֤וּ שַׂלְמֹֽתֵיכֶם֙ מֵעֲלֵיכֶ֔ם וְנַֽעַלְךָ֥ לֹֽא־בָלְתָ֖ה מֵעַ֥ל רַגְלֶֽךָ׃,ד,כט,Deuteronomy,1
לְבִנְיָמִ֣ן אָמַ֔ר יְדִ֣יד יְהֹוָ֔ה יִשְׁכֹּ֥ן לָבֶ֖טַח עָלָ֑יו חֹפֵ֤ף עָלָיו֙ כׇּל־הַיּ֔וֹם וּבֵ֥ין כְּתֵפָ֖יו שָׁכֵֽן׃ ס,יב,לג,Deuteronomy,11
לֹא־תֹאבֶ֣ה ל֔וֹ וְלֹ֥א תִשְׁמַ֖ע אֵלָ֑יו וְלֹא־תָח֤וֹס עֵֽינְךָ֙ עָלָ֔יו וְלֹֽא־תַחְמֹ֥ל וְלֹֽא־תְכַסֶּ֖ה עָלָֽיו׃,ט,יג,Deuteronomy,11
יַכְּכָ֨ה יְהוָ֜ה בִּשְׁחִ֣ין רָ֗ע עַל־הַבִּרְכַּ֨יִם֙ וְעַל־הַשֹּׁקַ֔יִם אֲשֶׁ֥ר לֹא־תוּכַ֖ל לְהֵרָפֵ֑א מִכַּ֥ף רַגְלְךָ֖ וְעַ֥ד קׇדְקֳדֶֽךָ׃,לה,כח,Deuteronomy,1
עַל־פִּ֨י הַתּוֹרָ֜ה אֲשֶׁ֣ר יוֹר֗וּךָ וְעַל־הַמִּשְׁפָּ֛ט אֲשֶׁר־יֹאמְר֥וּ לְךָ֖ תַּעֲשֶׂ֑ה לֹ֣א תָס֗וּר מִן־הַדָּבָ֛ר אֲשֶׁר־יַגִּ֥ידֽוּ לְךָ֖ יָמִ֥ין וּשְׂמֹֽאל׃,יא,יז,Deuteronomy,11
רַ֥ק אֶת־דָּמ֖וֹ לֹ֣א תֹאכֵ֑ל עַל־הָאָ֥רֶץ תִּשְׁפְּכֶ֖נּוּ כַּמָּֽיִם׃ פ,כג,טו,Deuteronomy,1
עַל־כֵּ֛ן אָנֹכִ֥י מְצַוְּךָ֖ לֵאמֹ֑ר שָׁלֹ֥שׁ עָרִ֖ים תַּבְדִּ֥יל לָֽךְ׃ ס,ז,יט,Deuteronomy,7
וְהָי֥וּ שָׁמֶ֛יךָ אֲשֶׁ֥ר עַל־רֹאשְׁךָ֖ נְחֹ֑שֶׁת וְהָאָ֥רֶץ אֲשֶׁר־תַּחְתֶּ֖יךָ בַּרְזֶֽל׃,כג,כח,Deuteronomy,1
וַיָּ֨מׇת שָׁ֜ם מֹשֶׁ֧ה עֶֽבֶד־יְהוָ֛ה בְּאֶ֥רֶץ מוֹאָ֖ב עַל־פִּ֥י יְהוָֽה׃,ה,לד,Deuteronomy,7
עַל־דְּבַ֞ר אֲשֶׁ֨ר לֹא־קִדְּמ֤וּ אֶתְכֶם֙ בַּלֶּ֣חֶם וּבַמַּ֔יִם בַּדֶּ֖רֶךְ בְּצֵאתְכֶ֣ם מִמִּצְרָ֑יִם וַאֲשֶׁר֩ שָׂכַ֨ר עָלֶ֜יךָ אֶת־בִּלְעָ֣ם בֶּן־בְּע֗וֹר מִפְּת֛וֹר אֲרַ֥ם נַהֲרַ֖יִם לְקַֽלְלֶֽךָּ׃,ה,כג,Deuteronomy,7
בְּיוֹמוֹ֩ תִתֵּ֨ן שְׂכָר֜וֹ וְֽלֹא־תָב֧וֹא עָלָ֣יו הַשֶּׁ֗מֶשׁ כִּ֤י עָנִי֙ ה֔וּא וְאֵלָ֕יו ה֥וּא נֹשֵׂ֖א אֶת־נַפְשׁ֑וֹ וְלֹֽא־יִקְרָ֤א עָלֶ֨יךָ֙ אֶל־יְהוָ֔ה וְהָיָ֥ה בְךָ֖ חֵֽטְא׃ ס,טו,כד,Deuteronomy,11
וְהוֹתִֽירְךָ֩ יְהוָ֨ה אֱלֹהֶ֜יךָ בְּכֹ֣ל ׀ מַעֲשֵׂ֣ה יָדֶ֗ךָ בִּפְרִ֨י בִטְנְךָ֜ וּבִפְרִ֧י בְהֶמְתְּךָ֛ וּבִפְרִ֥י אַדְמָתְךָ֖ לְטוֹבָ֑ה כִּ֣י ׀ יָשׁ֣וּב יְהוָ֗ה לָשׂ֤וּשׂ עָלֶ֨יךָ֙ לְט֔וֹב כַּאֲשֶׁר־שָׂ֖שׂ עַל־אֲבֹתֶֽיךָ׃,ט,ל,Deuteronomy,11
אַבֵּ֣ד תְּ֠אַבְּדוּן אֶֽת־כׇּל־הַמְּקֹמ֞וֹת אֲשֶׁ֧ר עָֽבְדוּ־שָׁ֣ם הַגּוֹיִ֗ם אֲשֶׁ֥ר אַתֶּ֛ם יֹרְשִׁ֥ים אֹתָ֖ם אֶת־אֱלֹהֵיהֶ֑ם עַל־הֶהָרִ֤ים הָֽרָמִים֙ וְעַל־הַגְּבָע֔וֹת וְתַ֖חַת כׇּל־עֵ֥ץ רַעֲנָן׃,ב,יב,Deuteronomy,1
לֹא־תֹאכַ֤ל עָלָיו֙ חָמֵ֔ץ שִׁבְעַ֥ת יָמִ֛ים תֹּֽאכַל־עָלָ֥יו מַצּ֖וֹת לֶ֣חֶם עֹ֑נִי כִּ֣י בְחִפָּז֗וֹן יָצָ֨אתָ֙ מֵאֶ֣רֶץ מִצְרַ֔יִם לְמַ֣עַן תִּזְכֹּ֗ר אֶת־י֤וֹם צֵֽאתְךָ֙ מֵאֶ֣רֶץ מִצְרַ֔יִם כֹּ֖ל יְמֵ֥י חַיֶּֽיךָ׃,ג,טז,Deuteronomy,1
הַעִידֹתִי֩ בָכֶ֨ם הַיּ֜וֹם אֶת־הַשָּׁמַ֣יִם וְאֶת־הָאָ֗רֶץ כִּֽי־אָבֹ֣ד תֹּאבֵדוּן֮ מַהֵר֒ מֵעַ֣ל הָאָ֔רֶץ אֲשֶׁ֨ר אַתֶּ֜ם עֹבְרִ֧ים אֶת־הַיַּרְדֵּ֛ן שָׁ֖מָּה לְרִשְׁתָּ֑הּ לֹֽא־תַאֲרִיכֻ֤ן יָמִים֙ עָלֶ֔יהָ כִּ֥י הִשָּׁמֵ֖ד תִּשָּׁמֵדֽוּן׃,כו,ד,Deuteronomy,1
מֵעֲרֹעֵ֞ר אֲשֶׁ֨ר עַל־שְׂפַת־נַ֧חַל אַרְנֹ֛ן וְעַד־הַ֥ר שִׂיאֹ֖ן ה֥וּא חֶרְמֽוֹן׃,מח,ד,Deuteronomy,2
הִשָּׁ֣מֶר לְךָ֔ פֶּֽן־תַּעֲזֹ֖ב אֶת־הַלֵּוִ֑י כׇּל־יָמֶ֖יךָ עַל־אַדְמָתֶֽךָ׃ ס,יט,יב,Deuteronomy,1
כִּֽי־תֵצֵ֥א לַמִּלְחָמָ֖ה עַל־אֹיְבֶ֑יךָ וּנְתָנ֞וֹ יְהוָ֧ה אֱלֹהֶ֛יךָ בְּיָדֶ֖ךָ וְשָׁבִ֥יתָ שִׁבְיֽוֹ׃,י,כא,Deuteronomy,11
וְכִֽי־יִהְיֶ֣ה בְאִ֗ישׁ חֵ֛טְא מִשְׁפַּט־מָ֖וֶת וְהוּמָ֑ת וְתָלִ֥יתָ אֹת֖וֹ עַל־עֵֽץ׃,כב,כא,Deuteronomy,1
גְּדִלִ֖ים תַּעֲשֶׂה־לָּ֑ךְ עַל־אַרְבַּ֛ע כַּנְפ֥וֹת כְּסוּתְךָ֖ אֲשֶׁ֥ר תְּכַסֶּה־בָּֽהּ׃ ס,יב,כב,Deuteronomy,1
וְכָתַבְתָּ֣ עַל־הָאֲבָנִ֗ים אֶֽת־כׇּל־דִּבְרֵ֛י הַתּוֹרָ֥ה הַזֹּ֖את בַּאֵ֥ר הֵיטֵֽב׃ ס,ח,כז,Deuteronomy,1
רֹכְבֵי֩ אֲתֹנ֨וֹת צְחֹר֜וֹת יֹשְׁבֵ֧י עַל־מִדִּ֛ין וְהֹלְכֵ֥י עַל־דֶּ֖רֶךְ שִֽׂיחוּ׃,י,ה,Judges,11
וְאַתֶּ֞ם קַמְתֶּ֨ם עַל־בֵּ֤ית אָבִי֙ הַיּ֔וֹם וַתַּהַרְג֧וּ אֶת־בָּנָ֛יו שִׁבְעִ֥ים אִ֖ישׁ עַל־אֶ֣בֶן אֶחָ֑ת וַתַּמְלִ֜יכוּ אֶת־אֲבִימֶ֤לֶךְ בֶּן־אֲמָתוֹ֙ עַל־בַּעֲלֵ֣י שְׁכֶ֔ם כִּ֥י אֲחִיכֶ֖ם הֽוּא׃,יח,ט,Judges,11
וַיֹּ֣אמֶר לֵ֔כִי וַיִּשְׁלַ֥ח אוֹתָ֖הּ שְׁנֵ֣י חֳדָשִׁ֑ים וַתֵּ֤לֶךְ הִיא֙ וְרֵ֣עוֹתֶ֔יהָ וַתֵּ֥בְךְּ עַל־בְּתוּלֶ֖יהָ עַל־הֶהָרִֽים׃,לח,יא,Judges,11
וַתֹּ֨אמֶר֙ אֶל־אָבִ֔יהָ יֵעָ֥שֶׂה לִּ֖י הַדָּבָ֣ר הַזֶּ֑ה הַרְפֵּ֨ה מִמֶּ֜נִּי שְׁנַ֣יִם חֳדָשִׁ֗ים וְאֵֽלְכָה֙ וְיָרַדְתִּ֣י עַל־הֶֽהָרִ֔ים וְאֶבְכֶּה֙ עַל־בְּתוּלַ֔י אָנֹכִ֖י (ורעיתי) [וְרֵעוֹתָֽי]׃,לז,יא,Judges,11
וַיֹּסִ֨פוּ֙ בְּנֵ֣י יִשְׂרָאֵ֔ל לַעֲשׂ֥וֹת הָרַ֖ע בְּעֵינֵ֣י יְהוָ֑ה וַיְחַזֵּ֨ק יְהוָ֜ה אֶת־עֶגְל֤וֹן מֶֽלֶךְ־מוֹאָב֙ עַל־יִשְׂרָאֵ֔ל עַ֛ל כִּֽי־עָשׂ֥וּ אֶת־הָרַ֖ע בְּעֵינֵ֥י יְהוָֽה׃,יב,ג,Judges,11
וְהֵ֨מָּה לָקְח֜וּ אֵ֧ת אֲשֶׁר־עָשָׂ֣ה מִיכָ֗ה וְֽאֶת־הַכֹּהֵן֮ אֲשֶׁ֣ר הָיָה־לוֹ֒ וַיָּבֹ֣אוּ עַל־לַ֗יִשׁ עַל־עַם֙ שֹׁקֵ֣ט וּבֹטֵ֔חַ וַיַּכּ֥וּ אוֹתָ֖ם לְפִי־חָ֑רֶב וְאֶת־הָעִ֖יר שָׂרְפ֥וּ בָאֵֽשׁ׃,כז,יח,Judges,11
וַיִּשְׁכַּ֣ב שִׁמְשׁוֹן֮ עַד־חֲצִ֣י הַלַּיְלָה֒ וַיָּ֣קׇם ׀ בַּחֲצִ֣י הַלַּ֗יְלָה וַיֶּאֱחֹ֞ז בְּדַלְת֤וֹת שַֽׁעַר־הָעִיר֙ וּבִשְׁתֵּ֣י הַמְּזוּז֔וֹת וַיִּסָּעֵם֙ עִֽם־הַבְּרִ֔יחַ וַיָּ֖שֶׂם עַל־כְּתֵפָ֑יו וַֽיַּעֲלֵם֙ אֶל־רֹ֣אשׁ הָהָ֔ר אֲשֶׁ֖ר עַל־פְּנֵ֥י חֶבְרֽוֹן׃ פ,ג,טז,Judges,1
הוּא־בָ֣א עַד־לֶ֔חִי וּפְלִשְׁתִּ֖ים הֵרִ֣יעוּ לִקְרָאת֑וֹ וַתִּצְלַ֨ח עָלָ֜יו ר֣וּחַ יְהוָ֗ה וַתִּהְיֶ֨ינָה הָעֲבֹתִ֜ים אֲשֶׁ֣ר עַל־זְרוֹעוֹתָ֗יו כַּפִּשְׁתִּים֙ אֲשֶׁ֣ר בָּעֲר֣וּ בָאֵ֔שׁ וַיִּמַּ֥סּוּ אֱסוּרָ֖יו מֵעַ֥ל יָדָֽיו׃,יד,טו,Judges,11
וַיָּ֧שַׂר אֲבִימֶ֛לֶךְ עַל־יִשְׂרָאֵ֖ל שָׁלֹ֥שׁ שָׁנִֽים׃,כב,ט,Judges,11
וַיָּק֥וּמוּ בְנֵֽי־יִשְׂרָאֵ֖ל בַּבֹּ֑קֶר וַיַּֽחֲנ֖וּ עַל־הַגִּבְעָֽה׃ פ,יט,כ,Judges,1
הָל֤וֹךְ הָֽלְכוּ֙ הָעֵצִ֔ים לִמְשֹׁ֥חַ עֲלֵיהֶ֖ם מֶ֑לֶךְ וַיֹּאמְר֥וּ לַזַּ֖יִת (מלוכה) [מׇלְכָ֥ה] עָלֵֽינוּ׃,ח,ט,Judges,11
זְבֻל֗וּן עַ֣ם חֵרֵ֥ף נַפְשׁ֛וֹ לָמ֖וּת וְנַפְתָּלִ֑י עַ֖ל מְרוֹמֵ֥י שָׂדֶֽה׃,יח,ה,Judges,1
וַתְּיַשְּׁנֵ֨הוּ֙ עַל־בִּרְכֶּ֔יהָ וַתִּקְרָ֣א לָאִ֔ישׁ וַתְּגַלַּ֕ח אֶת־שֶׁ֖בַע מַחְלְפ֣וֹת רֹאשׁ֑וֹ וַתָּ֨חֶל֙ לְעַנּוֹת֔וֹ וַיָּ֥סַר כֹּח֖וֹ מֵעָלָֽיו׃,יט,טז,Judges,1
וַיִּלְפֹּ֨ת שִׁמְשׁ֜וֹן אֶת־שְׁנֵ֣י ׀ עַמּוּדֵ֣י הַתָּ֗וֶךְ אֲשֶׁ֤ר הַבַּ֨יִת֙ נָכ֣וֹן עֲלֵיהֶ֔ם וַיִּסָּמֵ֖ךְ עֲלֵיהֶ֑ם אֶחָ֥ד בִּימִינ֖וֹ וְאֶחָ֥ד בִּשְׂמֹאלֽוֹ׃,כט,טז,Judges,1
וַיָּקֻ֤מוּ עָלַי֙ בַּעֲלֵ֣י הַגִּבְעָ֔ה וַיָּסֹ֧בּוּ עָלַ֛י אֶת־הַבַּ֖יִת לָ֑יְלָה אוֹתִי֙ דִּמּ֣וּ לַהֲרֹ֔ג וְאֶת־פִּילַגְשִׁ֥י עִנּ֖וּ וַתָּמֹֽת׃,ה,כ,Judges,11
וַיָּשִׂ֣ימוּ לוֹ֩ בַעֲלֵ֨י שְׁכֶ֜ם מְאָרְבִ֗ים עַ֚ל רָאשֵׁ֣י הֶהָרִ֔ים וַיִּגְזְל֗וּ אֵ֛ת כׇּל־אֲשֶׁר־יַעֲבֹ֥ר עֲלֵיהֶ֖ם בַּדָּ֑רֶךְ וַיֻּגַּ֖ד לַאֲבִימֶֽלֶךְ׃ פ,כה,ט,Judges,1
וַיֹּ֨אמֶר שִׁמְשׁ֜וֹן אֶל־הַנַּ֨עַר הַמַּחֲזִ֣יק בְּיָדוֹ֮ הַנִּ֣יחָה אוֹתִי֒ (והימשני) [וַהֲמִשֵׁ֨נִי֙] אֶת־הָֽעַמֻּדִ֔ים אֲשֶׁ֥ר הַבַּ֖יִת נָכ֣וֹן עֲלֵיהֶ֑ם וְאֶשָּׁעֵ֖ן עֲלֵיהֶֽם׃,כו,טז,Judges,1
וַיְהִי֩ בַעֲל֨וֹת הַלַּ֜הַב מֵעַ֤ל הַמִּזְבֵּ֨חַ֙ הַשָּׁמַ֔יְמָה וַיַּ֥עַל מַלְאַךְ־יְהוָ֖ה בְּלַ֣הַב הַמִּזְבֵּ֑חַ וּמָנ֤וֹחַ וְאִשְׁתּוֹ֙ רֹאִ֔ים וַיִּפְּל֥וּ עַל־פְּנֵיהֶ֖ם אָֽרְצָה׃,כ,יג,Judges,1
וַתִּקַּ֣ח דְּלִילָה֩ עֲבֹתִ֨ים חֲדָשִׁ֜ים וַתַּאַסְרֵ֣הוּ בָהֶ֗ם וַתֹּ֤אמֶר אֵלָיו֙ פְּלִשְׁתִּ֤ים עָלֶ֨יךָ֙ שִׁמְשׁ֔וֹן וְהָאֹרֵ֖ב יֹשֵׁ֣ב בֶּחָ֑דֶר וַֽיְנַתְּקֵ֛ם מֵעַ֥ל זְרֹעֹתָ֖יו כַּחֽוּט׃,יב,טז,Judges,11
וַתֹּ֕אמֶר פְּלִשְׁתִּ֥ים עָלֶ֖יךָ שִׁמְשׁ֑וֹן וַיִּקַ֣ץ מִשְּׁנָת֗וֹ וַיֹּ֨אמֶר֙ אֵצֵ֞א כְּפַ֤עַם בְּפַ֨עַם֙ וְאִנָּעֵ֔ר וְהוּא֙ לֹ֣א יָדַ֔ע כִּ֥י יְהוָ֖ה סָ֥ר מֵעָלָֽיו׃,כ,טז,Judges,11
וַיַּשְׁכִּ֜ימוּ אַנְשֵׁ֤י הָעִיר֙ בַּבֹּ֔קֶר וְהִנֵּ֤ה נֻתַּץ֙ מִזְבַּ֣ח הַבַּ֔עַל וְהָאֲשֵׁרָ֥ה אֲשֶׁר־עָלָ֖יו כֹּרָ֑תָה וְאֵת֙ הַפָּ֣ר הַשֵּׁנִ֔י הֹֽעֲלָ֔ה עַל־הַמִּזְבֵּ֖חַ הַבָּנֽוּי׃,כח,ו,Judges,1
וְה֣וּא שָׁ֗ב מִן־הַפְּסִילִים֙ אֲשֶׁ֣ר אֶת־הַגִּלְגָּ֔ל וַיֹּ֕אמֶר דְּבַר־סֵ֥תֶר לִ֛י אֵלֶ֖יךָ הַמֶּ֑לֶךְ וַיֹּ֣אמֶר הָ֔ס וַיֵּֽצְאוּ֙ מֵֽעָלָ֔יו כׇּל־הָעֹמְדִ֖ים עָלָֽיו׃,יט,ג,Judges,11
וַיְהִ֕י כִּֽי־זָעֲק֥וּ בְנֵֽי־יִשְׂרָאֵ֖ל אֶל־יְהוָ֑ה עַ֖ל אֹד֥וֹת מִדְיָֽן׃,ז,ו,Judges,7
וַתְּהִ֨י עָלָ֥יו רֽוּחַ־יְהוָה֮ וַיִּשְׁפֹּ֣ט אֶת־יִשְׂרָאֵל֒ וַיֵּצֵא֙ לַמִּלְחָמָ֔ה וַיִּתֵּ֤ן יְהוָה֙ בְּיָד֔וֹ אֶת־כּוּשַׁ֥ן רִשְׁעָתַ֖יִם מֶ֣לֶךְ אֲרָ֑ם וַתָּ֣עׇז יָד֔וֹ עַ֖ל כּוּשַׁ֥ן רִשְׁעָתָֽיִם׃,י,ג,Judges,11
לָב֕וֹא חֲמַ֖ס שִׁבְעִ֣ים בְּנֵֽי־יְרֻבָּ֑עַל וְדָמָ֗ם לָשׂ֞וּם עַל־אֲבִימֶ֤לֶךְ אֲחִיהֶם֙ אֲשֶׁ֣ר הָרַ֣ג אוֹתָ֔ם וְעַל֙ בַּעֲלֵ֣י שְׁכֶ֔ם אֲשֶׁר־חִזְּק֥וּ אֶת־יָדָ֖יו לַהֲרֹ֥ג אֶת־אֶחָֽיו׃,כד,ט,Judges,11
הִנֵּ֣ה אָנֹכִ֗י מַצִּ֛יג אֶת־גִּזַּ֥ת הַצֶּ֖מֶר בַּגֹּ֑רֶן אִ֡ם טַל֩ יִהְיֶ֨ה עַֽל־הַגִּזָּ֜ה לְבַדָּ֗הּ וְעַל־כׇּל־הָאָ֨רֶץ֙ חֹ֔רֶב וְיָדַעְתִּ֗י כִּֽי־תוֹשִׁ֧יעַ בְּיָדִ֛י אֶת־יִשְׂרָאֵ֖ל כַּאֲשֶׁ֥ר דִּבַּֽרְתָּ׃,לז,ו,Judges,1
וַיִּכְרְת֨וּ גַם־כׇּל־הָעָ֜ם אִ֣ישׁ שׂוֹכֹ֗ה וַיֵּ֨לְכ֜וּ אַחֲרֵ֤י אֲבִימֶ֨לֶךְ֙ וַיָּשִׂ֣ימוּ עַֽל־הַצְּרִ֔יחַ וַיַּצִּ֧יתוּ עֲלֵיהֶ֛ם אֶֽת־הַצְּרִ֖יחַ בָּאֵ֑שׁ וַיָּמֻ֜תוּ גַּ֣ם כׇּל־אַנְשֵׁ֧י מִֽגְדַּל־שְׁכֶ֛ם כְּאֶ֖לֶף אִ֥ישׁ וְאִשָּֽׁה׃ פ,מט,ט,Judges,2
