הפסוק,פסוק,פרק,ספר,משמעות
וַיֹּ֨אמֶר֙ אַבְשָׁל֔וֹם מִי־יְשִׂמֵ֥נִי שֹׁפֵ֖ט בָּאָ֑רֶץ וְעָלַ֗י יָב֥וֹא כׇּל־אִ֛ישׁ אֲשֶֽׁר־יִהְיֶה־לּוֹ־רִ֥יב וּמִשְׁפָּ֖ט וְהִצְדַּקְתִּֽיו׃,ד,טו,II_Samuel,2
תְּמ֣וֹל ׀ בּוֹאֶ֗ךָ וְהַיּ֞וֹם (אנועך) [אֲנִֽיעֲךָ֤] עִמָּ֨נוּ֙ לָלֶ֔כֶת וַאֲנִ֣י הוֹלֵ֔ךְ עַ֥ל אֲשֶׁר־אֲנִ֖י הוֹלֵ֑ךְ שׁ֣וּב וְהָשֵׁ֧ב אֶת־אַחֶ֛יךָ עִמָּ֖ךְ חֶ֥סֶד וֶאֱמֶֽת׃,כ,טו,II_Samuel,3
וַיָּבֹ֨א יוֹאָ֣ב אֶל־הַמֶּלֶךְ֮ וַיַּגֶּד־לוֹ֒ וַיִּקְרָ֤א אֶל־אַבְשָׁלוֹם֙ וַיָּבֹ֣א אֶל־הַמֶּ֔לֶךְ וַיִּשְׁתַּ֨חוּ ל֧וֹ עַל־אַפָּ֛יו אַ֖רְצָה לִפְנֵ֣י הַמֶּ֑לֶךְ וַיִּשַּׁ֥ק הַמֶּ֖לֶךְ לְאַבְשָׁלֽוֹם׃ פ,לג,יד,II_Samuel,1
וְדָוִ֗ד עָבַ֤ר מְעַט֙ מֵֽהָרֹ֔אשׁ וְהִנֵּ֥ה צִיבָ֛א נַ֥עַר מְפִי־בֹ֖שֶׁת לִקְרָאת֑וֹ וְצֶ֨מֶד חֲמֹרִ֜ים חֲבֻשִׁ֗ים וַעֲלֵיהֶם֩ מָאתַ֨יִם לֶ֜חֶם וּמֵאָ֧ה צִמּוּקִ֛ים וּמֵ֥אָה קַ֖יִץ וְנֵ֥בֶל יָֽיִן׃,א,טז,II_Samuel,1
וְאָב֣וֹא עָלָ֗יו וְה֤וּא יָגֵ֨עַ֙ וּרְפֵ֣ה יָדַ֔יִם וְהַֽחֲרַדְתִּ֣י אֹת֔וֹ וְנָ֖ס כׇּל־הָעָ֣ם אֲשֶׁר־אִתּ֑וֹ וְהִכֵּיתִ֥י אֶת־הַמֶּ֖לֶךְ לְבַדּֽוֹ׃,ב,יז,II_Samuel,11
וַיְהִ֣י ׀ אַחֲרֵ֣י לֶכְתָּ֗ם וַֽיַּעֲלוּ֙ מֵֽהַבְּאֵ֔ר וַיֵּ֣לְכ֔וּ וַיַּגִּ֖דוּ לַמֶּ֣לֶךְ דָּוִ֑ד וַיֹּאמְר֣וּ אֶל־דָּוִ֗ד ק֣וּמוּ וְעִבְר֤וּ מְהֵרָה֙ אֶת־הַמַּ֔יִם כִּי־כָ֛כָה יָעַ֥ץ עֲלֵיכֶ֖ם אֲחִיתֹֽפֶל׃,כא,יז,II_Samuel,1
וַיְצַ֣ו הַמֶּ֡לֶךְ אֶת־י֠וֹאָב וְאֶת־אֲבִישַׁ֤י וְאֶת־אִתַּי֙ לֵאמֹ֔ר לְאַט־לִ֖י לַנַּ֣עַר לְאַבְשָׁל֑וֹם וְכׇל־הָעָ֣ם שָׁמְע֗וּ בְּצַוֹּ֥ת הַמֶּ֛לֶךְ אֶת־כׇּל־הַשָּׂרִ֖ים עַל־דְּבַ֥ר אַבְשָׁלֽוֹם׃,ה,יח,II_Samuel,7
וַתְּהִ֨י הַתְּשֻׁעָ֜ה בַּיּ֥וֹם הַה֛וּא לְאֵ֖בֶל לְכׇל־הָעָ֑ם כִּֽי־שָׁמַ֣ע הָעָ֗ם בַּיּ֤וֹם הַהוּא֙ לֵאמֹ֔ר נֶעֱצַ֥ב הַמֶּ֖לֶךְ עַל־בְּנֽוֹ׃,ג,יט,II_Samuel,7
וַיִּרְגַּ֣ז הַמֶּ֗לֶךְ וַיַּ֛עַל עַל־עֲלִיַּ֥ת הַשַּׁ֖עַר וַיֵּ֑בְךְּ וְכֹ֣ה ׀ אָמַ֣ר בְּלֶכְתּ֗וֹ בְּנִ֤י אַבְשָׁלוֹם֙ בְּנִ֣י בְנִ֣י אַבְשָׁל֔וֹם מִֽי־יִתֵּ֤ן מוּתִי֙ אֲנִ֣י תַחְתֶּ֔יךָ אַבְשָׁל֖וֹם בְּנִ֥י בְנִֽי׃,א,יט,II_Samuel,1
וַיַּעַן֩ כׇּל־אִ֨ישׁ יְהוּדָ֜ה עַל־אִ֣ישׁ יִשְׂרָאֵ֗ל כִּֽי־קָר֤וֹב הַמֶּ֨לֶךְ֙ אֵלַ֔י וְלָ֤מָּה זֶּה֙ חָרָ֣ה לְךָ֔ עַל־הַדָּבָ֖ר הַזֶּ֑ה הֶאָכ֤וֹל אָכַ֨לְנוּ֙ מִן־הַמֶּ֔לֶךְ אִם־נִשֵּׂ֥את נִשָּׂ֖א לָֽנוּ׃ ס,מג,יט,II_Samuel,11
וַיָּבֹ֜אוּ וַיָּצֻ֣רוּ עָלָ֗יו בְּאָבֵ֨לָה֙ בֵּ֣ית הַֽמַּעֲכָ֔ה וַיִּשְׁפְּכ֤וּ סֹֽלְלָה֙ אֶל־הָעִ֔יר וַֽתַּעֲמֹ֖ד בַּחֵ֑ל וְכׇל־הָעָם֙ אֲשֶׁ֣ר אֶת־יוֹאָ֔ב מַשְׁחִיתִ֖ם לְהַפִּ֥יל הַחוֹמָֽה׃,טו,כ,II_Samuel,11
לֹא־כֵ֣ן הַדָּבָ֗ר כִּ֡י אִישׁ֩ מֵהַ֨ר אֶפְרַ֜יִם שֶׁ֧בַע בֶּן־בִּכְרִ֣י שְׁמ֗וֹ נָשָׂ֤א יָדוֹ֙ בַּמֶּ֣לֶךְ בְּדָוִ֔ד תְּנֽוּ־אֹת֣וֹ לְבַדּ֔וֹ וְאֵלְכָ֖ה מֵעַ֣ל הָעִ֑יר וַתֹּ֤אמֶר הָֽאִשָּׁה֙ אֶל־יוֹאָ֔ב הִנֵּ֥ה רֹאשׁ֛וֹ מֻשְׁלָ֥ךְ אֵלֶ֖יךָ בְּעַ֥ד הַחוֹמָֽה׃,כא,כ,II_Samuel,1
וַאֲדֹרָ֖ם עַל־הַמַּ֑ס וִיהוֹשָׁפָ֥ט בֶּן־אֲחִיל֖וּד הַמַּזְכִּֽיר׃,כד,כ,II_Samuel,11
וַיְהִ֣י רָעָב֩ בִּימֵ֨י דָוִ֜ד שָׁלֹ֣שׁ שָׁנִ֗ים שָׁנָה֙ אַחֲרֵ֣י שָׁנָ֔ה וַיְבַקֵּ֥שׁ דָּוִ֖ד אֶת־פְּנֵ֣י יְהוָ֑ה ס וַיֹּ֣אמֶר יְהוָ֗ה אֶל־שָׁאוּל֙ וְאֶל־בֵּ֣ית הַדָּמִ֔ים עַל־אֲשֶׁר־הֵמִ֖ית אֶת־הַגִּבְעֹנִֽים׃,א,כא,II_Samuel,11
הָל֞וֹךְ וְדִבַּרְתָּ֣ אֶל־דָּוִ֗ד כֹּ֚ה אָמַ֣ר יְהוָ֔ה שָׁלֹ֕שׁ אָנֹכִ֖י נוֹטֵ֣ל עָלֶ֑יךָ בְּחַר־לְךָ֥ אַֽחַת־מֵהֶ֖ם וְאֶֽעֱשֶׂה־לָּֽךְ׃,יב,כד,II_Samuel,11
וַיַּשְׁקֵ֣ף אֲרַ֗וְנָה וַיַּ֤רְא אֶת־הַמֶּ֨לֶךְ֙ וְאֶת־עֲבָדָ֔יו עֹבְרִ֖ים עָלָ֑יו וַיֵּצֵ֣א אֲרַ֔וְנָה וַיִּשְׁתַּ֧חוּ לַמֶּ֛לֶךְ אַפָּ֖יו אָֽרְצָה׃,כ,כד,II_Samuel,11
וַיִּבֶן֩ שָׁ֨ם דָּוִ֤ד מִזְבֵּ֨חַ֙ לַֽיהוָ֔ה וַיַּ֥עַל עֹל֖וֹת וּשְׁלָמִ֑ים וַיֵּעָתֵ֤ר יְהוָה֙ לָאָ֔רֶץ וַתֵּעָצַ֥ר הַמַּגֵּפָ֖ה מֵעַ֥ל יִשְׂרָאֵֽל׃,כה,כד,II_Samuel,11
וַיֶּחֱזַ֤ק דְּבַר־הַמֶּ֨לֶךְ֙ אֶל־יוֹאָ֔ב וְעַ֖ל שָׂרֵ֣י הֶחָ֑יִל וַיֵּצֵ֨א יוֹאָ֜ב וְשָׂרֵ֤י הַחַ֨יִל֙ לִפְנֵ֣י הַמֶּ֔לֶךְ לִפְקֹ֥ד אֶת־הָעָ֖ם אֶת־יִשְׂרָאֵֽל׃,ד,כד,II_Samuel,11
וְאַבְשָׁלוֹם֙ אֲשֶׁ֣ר מָשַׁ֣חְנוּ עָלֵ֔ינוּ מֵ֖ת בַּמִּלְחָמָ֑ה וְעַתָּ֗ה לָמָ֥ה אַתֶּ֛ם מַחֲרִשִׁ֖ים לְהָשִׁ֥יב אֶת־הַמֶּֽלֶךְ׃ ס,יא,יט,II_Samuel,11
וַיִּקְח֣וּ אֶת־אַבְשָׁל֗וֹם וַיַּשְׁלִ֨יכוּ אֹת֤וֹ בַיַּ֨עַר֙ אֶל־הַפַּ֣חַת הַגָּד֔וֹל וַיַּצִּ֧בוּ עָלָ֛יו גַּל־אֲבָנִ֖ים גָּד֣וֹל מְאֹ֑ד וְכׇל־יִשְׂרָאֵ֔ל נָ֖סוּ אִ֥ישׁ (לאהלו) [לְאֹהָלָֽיו]׃,יז,יח,II_Samuel,11
וַיְהִ֣י ׀ אַחֲרֵ֣י לֶכְתָּ֗ם וַֽיַּעֲלוּ֙ מֵֽהַבְּאֵ֔ר וַיֵּ֣לְכ֔וּ וַיַּגִּ֖דוּ לַמֶּ֣לֶךְ דָּוִ֑ד וַיֹּאמְר֣וּ אֶל־דָּוִ֗ד ק֣וּמוּ וְעִבְר֤וּ מְהֵרָה֙ אֶת־הַמַּ֔יִם כִּי־כָ֛כָה יָעַ֥ץ עֲלֵיכֶ֖ם אֲחִיתֹֽפֶל׃,כא,יז,II_Samuel,1
וַיֹּ֥אמֶר ל֖וֹ דָּוִ֑ד אִ֚ם עָבַ֣רְתָּ אִתִּ֔י וְהָיִ֥תָ עָלַ֖י לְמַשָּֽׂא׃,לג,טו,II_Samuel,11
וַיְהִ֤י דָוִד֙ בָּ֣א עַד־הָרֹ֔אשׁ אֲשֶֽׁר־יִשְׁתַּחֲוֶ֥ה שָׁ֖ם לֵאלֹהִ֑ים וְהִנֵּ֤ה לִקְרָאתוֹ֙ חוּשַׁ֣י הָאַרְכִּ֔י קָר֨וּעַ֙ כֻּתׇּנְתּ֔וֹ וַאֲדָמָ֖ה עַל־רֹאשֽׁוֹ׃,לב,טו,II_Samuel,1
וַיֹּ֤אמֶר לוֹ֙ יְה֣וֹנָדָ֔ב שְׁכַ֥ב עַל־מִשְׁכָּבְךָ֖ וְהִתְחָ֑ל וּבָ֧א אָבִ֣יךָ לִרְאוֹתֶ֗ךָ וְאָמַרְתָּ֣ אֵלָ֡יו תָּ֣בֹא נָא֩ תָמָ֨ר אֲחוֹתִ֜י וְתַבְרֵ֣נִי לֶ֗חֶם וְעָשְׂתָ֤ה לְעֵינַי֙ אֶת־הַבִּרְיָ֔ה לְמַ֨עַן֙ אֲשֶׁ֣ר אֶרְאֶ֔ה וְאָכַלְתִּ֖י מִיָּדָֽהּ׃,ה,יג,II_Samuel,1
וְאֶת־הַכִּבְשָׂ֖ה יְשַׁלֵּ֣ם אַרְבַּעְתָּ֑יִם עֵ֗קֶב אֲשֶׁ֤ר עָשָׂה֙ אֶת־הַדָּבָ֣ר הַזֶּ֔ה וְעַ֖ל אֲשֶׁ֥ר לֹֽא־חָמָֽל׃,ו,יב,II_Samuel,11
וְהִנֵּה֙ הִכֵּ֣יתִי כַפִּ֔י אֶל־בִּצְעֵ֖ךְ אֲשֶׁ֣ר עָשִׂ֑ית וְעַ֨ל־דָּמֵ֔ךְ אֲשֶׁ֥ר הָי֖וּ בְּתוֹכֵֽךְ׃,יג,כב,Ezekiel,7
וָאֶשְׁפֹּ֤ךְ עֲלֵיהֶם֙ זַעְמִ֔י בְּאֵ֥שׁ עֶבְרָתִ֖י כִּלִּיתִ֑ים דַּרְכָּם֙ בְּרֹאשָׁ֣ם נָתַ֔תִּי נְאֻ֖ם אֲדֹנָ֥י יְהֹוִֽה׃ פ,לא,כב,Ezekiel,11
וְכִנַּסְתִּ֣י אֶתְכֶ֔ם וְנָפַחְתִּ֥י עֲלֵיכֶ֖ם בְּאֵ֣שׁ עֶבְרָתִ֑י וְנִתַּכְתֶּ֖ם בְּתוֹכָֽהּ׃,כא,כב,Ezekiel,11
עָשֹׂ֥ה אֵ֖לֶּה לָ֑ךְ בִּזְנוֹתֵךְ֙ אַחֲרֵ֣י גוֹיִ֔ם עַ֥ל אֲשֶׁר־נִטְמֵ֖את בְּגִלּוּלֵיהֶֽם׃,ל,כג,Ezekiel,7
וְק֣וֹל הָמוֹן֮ שָׁלֵ֣ו בָהּ֒ וְאֶל־אֲנָשִׁים֙ מֵרֹ֣ב אָדָ֔ם מוּבָאִ֥ים (סובאים) [סׇבָאִ֖ים] מִמִּדְבָּ֑ר וַֽיִּתְּנ֤וּ צְמִידִים֙ אֶל־יְדֵיהֶ֔ן וַעֲטֶ֥רֶת תִּפְאֶ֖רֶת עַל־רָאשֵׁיהֶֽן׃,מב,כג,Ezekiel,1
וּפְאֵרֵכֶ֣ם עַל־רָאשֵׁיכֶ֗ם וְנַֽעֲלֵיכֶם֙ בְּרַגְלֵיכֶ֔ם לֹ֥א תִסְפְּד֖וּ וְלֹ֣א תִבְכּ֑וּ וּנְמַקֹּתֶם֙ בַּעֲוֹנֹ֣תֵיכֶ֔ם וּנְהַמְתֶּ֖ם אִ֥ישׁ אֶל־אָחִֽיו׃,כג,כד,Ezekiel,1
בְּנוֹתַ֥יִךְ בַּשָּׂדֶ֖ה בַּחֶ֣רֶב יַהֲרֹ֑ג וְנָתַ֨ן עָלַ֜יִךְ דָּיֵ֗ק וְשָׁפַ֤ךְ עָלַ֨יִךְ֙ סֹֽלְלָ֔ה וְהֵקִ֥ים עָלַ֖יִךְ צִנָּֽה׃,ח,כו,Ezekiel,11
וְהִשְׁמִ֤יעוּ עָלַ֨יִךְ֙ בְּקוֹלָ֔ם וְיִזְעֲק֖וּ מָרָ֑ה וְיַעֲל֤וּ עָֽפָר֙ עַל־רָ֣אשֵׁיהֶ֔ם בָּאֵ֖פֶר יִתְפַּלָּֽשׁוּ׃,ל,כז,Ezekiel,7
וְנָשְׂא֨וּ אֵלַ֤יִךְ בְּנִיהֶם֙ קִינָ֔ה וְקוֹנְנ֖וּ עָלָ֑יִךְ מִ֣י כְצ֔וֹר כְּדֻמָ֖ה בְּת֥וֹךְ הַיָּֽם׃,לב,כז,Ezekiel,7
וְשִׁלַּחְתִּי־בָ֞הּ דֶּ֤בֶר וָדָם֙ בְּח֣וּצוֹתֶ֔יהָ וְנִפְלַ֤ל חָלָל֙ בְּתוֹכָ֔הּ בְּחֶ֥רֶב עָלֶ֖יהָ מִסָּבִ֑יב וְיָדְע֖וּ כִּֽי־אֲנִ֥י יְהוָֽה׃,כג,כח,Ezekiel,1
מֵרֹ֣ב עֲוֹנֶ֗יךָ בְּעֶ֨וֶל֙ רְכֻלָּ֣תְךָ֔ חִלַּ֖לְתָּ מִקְדָּשֶׁ֑יךָ וָֽאוֹצִא־אֵ֤שׁ מִתּֽוֹכְךָ֙ הִ֣יא אֲכָלַ֔תְךָ וָאֶתֶּנְךָ֤ לְאֵ֨פֶר֙ עַל־הָאָ֔רֶץ לְעֵינֵ֖י כׇּל־רֹאֶֽיךָ׃,יח,כח,Ezekiel,1
בְּתׇפְשָׂ֨ם בְּךָ֤ (בכפך) [בַכַּף֙] תֵּר֔וֹץ וּבָקַעְתָּ֥ לָהֶ֖ם כׇּל־כָּתֵ֑ף וּבְהִֽשָּׁעֲנָ֤ם עָלֶ֨יךָ֙ תִּשָּׁבֵ֔ר וְהַעֲמַדְתָּ֥ לָהֶ֖ם כׇּל־מׇתְנָֽיִם׃ ס,ז,כט,Ezekiel,11
וְרָאָ֥ה אֶת־הַחֶ֖רֶב בָּאָ֣ה עַל־הָאָ֑רֶץ וְתָקַ֥ע בַּשּׁוֹפָ֖ר וְהִזְהִ֥יר אֶת־הָעָֽם׃,ג,לג,Ezekiel,3
בְּאׇמְרִ֤י לַצַּדִּיק֙ חָיֹ֣ה יִֽחְיֶ֔ה וְהֽוּא־בָטַ֥ח עַל־צִדְקָת֖וֹ וְעָ֣שָׂה עָ֑וֶל כׇּל־(צדקתו) [צִדְקֹתָיו֙] לֹ֣א תִזָּכַ֔רְנָה וּבְעַוְל֥וֹ אֲשֶׁר־עָשָׂ֖ה בּ֥וֹ יָמֽוּת׃,יג ,לג,Ezekiel,11
יִשְׁגּ֤וּ צֹאנִי֙ בְּכׇל־הֶ֣הָרִ֔ים וְעַ֖ל כׇּל־גִּבְעָ֣ה רָמָ֑ה וְעַ֨ל כׇּל־פְּנֵ֤י הָאָ֨רֶץ֙ נָפֹ֣צוּ צֹאנִ֔י וְאֵ֥ין דּוֹרֵ֖שׁ וְאֵ֥ין מְבַקֵּֽשׁ׃,ו,לד,Ezekiel,1
וַהֲקִמֹתִ֨י עֲלֵיהֶ֜ם רֹעֶ֤ה אֶחָד֙ וְרָעָ֣ה אֶתְהֶ֔ן אֵ֖ת עַבְדִּ֣י דָוִ֑יד ה֚וּא יִרְעֶ֣ה אֹתָ֔ם וְהֽוּא־יִהְיֶ֥ה לָהֶ֖ן לְרֹעֶֽה׃,כג,לד,Ezekiel,11
יַ֗עַן הֱי֤וֹת לְךָ֙ אֵיבַ֣ת עוֹלָ֔ם וַתַּגֵּ֥ר אֶת־בְּנֵֽי־יִשְׂרָאֵ֖ל עַל־יְדֵי־חָ֑רֶב בְּעֵ֣ת אֵידָ֔ם בְּעֵ֖ת עֲוֹ֥ן קֵֽץ׃,ה,לה,Ezekiel,other
לָכֵ֕ן הִנָּבֵ֖א עַל־אַדְמַ֣ת יִשְׂרָאֵ֑ל וְאָמַרְתָּ֡ לֶהָרִ֣ים וְ֠לַגְּבָעוֹת לָאֲפִיקִ֨ים וְלַגֵּאָי֜וֹת כֹּֽה־אָמַ֣ר ׀ אֲדֹנָ֣י יְהוִ֗ה הִנְנִ֨י בְקִנְאָתִ֤י וּבַחֲמָתִי֙ דִּבַּ֔רְתִּי יַ֛עַן כְּלִמַּ֥ת גּוֹיִ֖ם נְשָׂאתֶֽם׃,ו,לו,Ezekiel,11
וְהוֹשַׁעְתִּ֣י אֶתְכֶ֔ם מִכֹּ֖ל טֻמְאֽוֹתֵיכֶ֑ם וְקָרָ֤אתִי אֶל־הַדָּגָן֙ וְהִרְבֵּיתִ֣י אֹת֔וֹ וְלֹא־אֶתֵּ֥ן עֲלֵיכֶ֖ם רָעָֽב׃,כט,לו,Ezekiel,11
וַיֹּ֖אמֶר אֵלָ֑י בֶּן־אָדָם֙ עֲמֹ֣ד עַל־רַגְלֶ֔יךָ וַאֲדַבֵּ֖ר אֹתָֽךְ׃,א,ב,Ezekiel,1
כְּמַרְאֵ֣ה הַקֶּ֡שֶׁת אֲשֶׁר֩ יִֽהְיֶ֨ה בֶעָנָ֜ן בְּי֣וֹם הַגֶּ֗שֶׁם כֵּ֣ן מַרְאֵ֤ה הַנֹּ֨גַהּ֙ סָבִ֔יב ה֕וּא מַרְאֵ֖ה דְּמ֣וּת כְּבוֹד־יְהוָ֑ה וָֽאֶרְאֶה֙ וָאֶפֹּ֣ל עַל־פָּנַ֔י וָאֶשְׁמַ֖ע ק֥וֹל מְדַבֵּֽר׃ ס,כה,א,Ezekiel,1
וְהִנֵּ֛ה נָתַ֥תִּי עָלֶ֖יךָ עֲבוֹתִ֑ים וְלֹֽא־תֵהָפֵ֤ךְ מִֽצִּדְּךָ֙ אֶל־צִדֶּ֔ךָ עַד־כַּלּוֹתְךָ֖ יְמֵ֥י מְצוּרֶֽךָ׃,ח,ד,Ezekiel,11
וְאָ֣מַרְתָּ֔ הָרֵי֙ יִשְׂרָאֵ֔ל שִׁמְע֖וּ דְּבַר־אֲדֹנָ֣י יְהוִ֑ה כֹּה־אָמַ֣ר אֲדֹנָ֣י יְ֠הוִה לֶהָרִ֨ים וְלַגְּבָע֜וֹת לָאֲפִיקִ֣ים (ולגאית) [וְלַגֵּאָי֗וֹת] הִנְנִ֨י אֲנִ֜י מֵבִ֤יא עֲלֵיכֶם֙ חֶ֔רֶב וְאִבַּדְתִּ֖י בָּמֽוֹתֵיכֶֽם׃,ג ,ו,Ezekiel,5
חֶ֖רֶב יְרֵאתֶ֑ם וְחֶ֨רֶב֙ אָבִ֣יא עֲלֵיכֶ֔ם נְאֻ֖ם אֲדֹנָ֥י יְהוִֽה׃,ח,יא,Ezekiel,11
וּפָרַשְׂתִּ֤י אֶת־רִשְׁתִּי֙ עָלָ֔יו וְנִתְפַּ֖שׂ בִּמְצֽוּדָתִ֑י וְהֵבֵאתִ֨י אֹת֤וֹ בָבֶ֨לָה֙ אֶ֣רֶץ כַּשְׂדִּ֔ים וְאוֹתָ֥הּ לֹֽא־יִרְאֶ֖ה וְשָׁ֥ם יָמֽוּת׃,יג,יב,Ezekiel,1
בֶּן־אָדָ֗ם הָאֲנָשִׁ֤ים הָאֵ֨לֶּה֙ הֶעֱל֤וּ גִלּֽוּלֵיהֶם֙ עַל־לִבָּ֔ם וּמִכְשׁ֣וֹל עֲוֹנָ֔ם נָתְנ֖וּ נֹ֣כַח פְּנֵיהֶ֑ם הַאִדָּרֹ֥שׁ אִדָּרֵ֖שׁ לָהֶֽם׃ ס,ג ,יד,Ezekiel,1
וָאֶעֱבֹ֤ר עָלַ֨יִךְ֙ וָֽאֶרְאֵ֔ךְ מִתְבּוֹסֶ֖סֶת בְּדָמָ֑יִךְ וָאֹ֤מַר לָךְ֙ בְּדָמַ֣יִךְ חֲיִ֔י וָאֹ֥מַר לָ֖ךְ בְּדָמַ֥יִךְ חֲיִֽי׃,ו,טז,Ezekiel,11
וּפָרַשְׂתִּ֤י עָלָיו֙ רִשְׁתִּ֔י וְנִתְפַּ֖שׂ בִּמְצֽוּדָתִ֑י וַהֲבִיאוֹתִ֣יהוּ בָבֶ֗לָה וְנִשְׁפַּטְתִּ֤י אִתּוֹ֙ שָׁ֔ם מַעֲל֖וֹ אֲשֶׁ֥ר מָֽעַל־בִּֽי׃,כ,יז,Ezekiel,1
חַי־אָ֕נִי נְאֻ֖ם אֲדֹנָ֣י יְהוִ֑ה אִם־לֹ֠א בְּיָ֨ד חֲזָקָ֜ה וּבִזְר֧וֹעַ נְטוּיָ֛ה וּבְחֵמָ֥ה שְׁפוּכָ֖ה אֶמְל֥וֹךְ עֲלֵיכֶֽם׃,לג,כ,Ezekiel,11
בֶּן־אָדָ֗ם בֵּ֤ית יִשְׂרָאֵל֙ יֹשְׁבִ֣ים עַל־אַדְמָתָ֔ם וַיְטַמְּא֣וּ אוֹתָ֔הּ בְּדַרְכָּ֖ם וּבַעֲלִֽילוֹתָ֑ם כְּטֻמְאַת֙ הַנִּדָּ֔ה הָיְתָ֥ה דַרְכָּ֖ם לְפָנָֽי׃,יז,לו,Ezekiel,1
וְזָרַקְתִּ֧י עֲלֵיכֶ֛ם מַ֥יִם טְהוֹרִ֖ים וּטְהַרְתֶּ֑ם מִכֹּ֧ל טֻמְאוֹתֵיכֶ֛ם וּמִכׇּל־גִּלּ֥וּלֵיכֶ֖ם אֲטַהֵ֥ר אֶתְכֶֽם׃,כה,לו,Ezekiel,1
וְהוֹשַׁעְתִּ֣י אֶתְכֶ֔ם מִכֹּ֖ל טֻמְאֽוֹתֵיכֶ֑ם וְקָרָ֤אתִי אֶל־הַדָּגָן֙ וְהִרְבֵּיתִ֣י אֹת֔וֹ וְלֹא־אֶתֵּ֥ן עֲלֵיכֶ֖ם רָעָֽב׃,כט,לו,Ezekiel,11
וְהִנַּבֵּ֖אתִי כַּאֲשֶׁ֣ר צִוָּ֑נִי וַתָּבוֹא֩ בָהֶ֨ם הָר֜וּחַ וַיִּֽחְי֗וּ וַיַּֽעַמְדוּ֙ עַל־רַגְלֵיהֶ֔ם חַ֖יִל גָּד֥וֹל מְאֹד־מְאֹֽד׃ ס,י,לז,Ezekiel,1
וְעַבְדִּ֤י דָוִד֙ מֶ֣לֶךְ עֲלֵיהֶ֔ם וְרוֹעֶ֥ה אֶחָ֖ד יִהְיֶ֣ה לְכֻלָּ֑ם וּבְמִשְׁפָּטַ֣י יֵלֵ֔כוּ וְחֻקֹּתַ֥י יִשְׁמְר֖וּ וְעָשׂ֥וּ אוֹתָֽם׃,כד,לז,Ezekiel,11
בֶּן־אָדָ֗ם שִׂ֤ים פָּנֶ֨יךָ֙ אֶל־גּוֹג֙ אֶ֣רֶץ הַמָּג֔וֹג נְשִׂ֕יא רֹ֖אשׁ מֶ֣שֶׁךְ וְתֻבָ֑ל וְהִנָּבֵ֖א עָלָֽיו׃,ב,לח,Ezekiel,11
כֹּֽה־אָמַ֞ר אֲדֹנָ֣י יְהוִ֗ה הַֽאַתָּה־ה֨וּא אֲשֶׁר־דִּבַּ֜רְתִּי בְּיָמִ֣ים קַדְמוֹנִ֗ים בְּיַד֙ עֲבָדַי֙ נְבִיאֵ֣י יִשְׂרָאֵ֔ל הַֽנִּבְּאִ֛ים בַּיָּמִ֥ים הָהֵ֖ם שָׁנִ֑ים לְהָבִ֥יא אֹתְךָ֖ עֲלֵיהֶֽם׃ ס,יז,לח,Ezekiel,11
וְשֹׁבַבְתִּ֨יךָ֙ וְשִׁשֵּׁאתִ֔יךָ וְהַעֲלִיתִ֖יךָ מִיַּרְכְּתֵ֣י צָפ֑וֹן וַהֲבִאוֹתִ֖ךָ עַל־הָרֵ֥י יִשְׂרָאֵֽל׃,ב,לט,Ezekiel,3
וְהָיָ֣ה ׀ בַּיּ֣וֹם הַה֗וּא בְּי֨וֹם בּ֥וֹא גוֹג֙ עַל־אַדְמַ֣ת יִשְׂרָאֵ֔ל נְאֻ֖ם אֲדֹנָ֣י יְהוִ֑ה תַּעֲלֶ֥ה חֲמָתִ֖י בְּאַפִּֽי׃,יח,לח,Ezekiel,1
וּבְקִנְאָתִ֥י בְאֵשׁ־עֶבְרָתִ֖י דִּבַּ֑רְתִּי אִם־לֹ֣א ׀ בַּיּ֣וֹם הַה֗וּא יִֽהְיֶה֙ רַ֣עַשׁ גָּד֔וֹל עַ֖ל אַדְמַ֥ת יִשְׂרָאֵֽל׃,יט,לח,Ezekiel,1
וְאַנְשֵׁ֨י תָמִ֤יד יַבְדִּ֨ילוּ֙ עֹבְרִ֣ים בָּאָ֔רֶץ מְקַבְּרִ֣ים אֶת־הָעֹבְרִ֗ים אֶת־הַנּוֹתָרִ֛ים עַל־פְּנֵ֥י הָאָ֖רֶץ לְטַֽהֲרָ֑הּ מִקְצֵ֥ה שִׁבְעָֽה־חֳדָשִׁ֖ים יַחְקֹֽרוּ׃,יד,לט,Ezekiel,1
וּשְׂבַעְתֶּ֤ם עַל־שֻׁלְחָנִי֙ ס֣וּס וָרֶ֔כֶב גִּבּ֖וֹר וְכׇל־אִ֣ישׁ מִלְחָמָ֑ה נְאֻ֖ם אֲדֹנָ֥י יְהוִֽה׃,כ,לט,Ezekiel,1
בְּמַרְא֣וֹת אֱלֹהִ֔ים הֱבִיאַ֖נִי אֶל־אֶ֣רֶץ יִשְׂרָאֵ֑ל וַיְנִיחֵ֗נִי אֶל־הַ֤ר גָּבֹ֨הַּ֙ מְאֹ֔ד וְעָלָ֥יו כְּמִבְנֵה־עִ֖יר מִנֶּֽגֶב׃,ב,מ,Ezekiel,1
זֹ֖את תּוֹרַ֣ת הַבָּ֑יִת עַל־רֹ֣אשׁ הָ֠הָר כׇּל־גְּבֻל֞וֹ סָבִ֤יב ׀ סָבִיב֙ קֹ֣דֶשׁ קׇדָשִׁ֔ים הִנֵּה־זֹ֖את תּוֹרַ֥ת הַבָּֽיִת׃,יב,מג,Ezekiel,1
וְהִקְרַבְתָּ֖ם לִפְנֵ֣י יְהוָ֑ה וְהִשְׁלִ֨יכוּ הַכֹּהֲנִ֤ים עֲלֵיהֶם֙ מֶ֔לַח וְהֶעֱל֥וּ אוֹתָ֛ם עֹלָ֖ה לַֽיהוָֽה׃,כד,מג,Ezekiel,1
וְשֶׂה־אַחַ֨ת מִן־הַצֹּ֤אן מִן־הַמָּאתַ֨יִם֙ מִמַּשְׁקֵ֣ה יִשְׂרָאֵ֔ל לְמִנְחָ֖ה וּלְעוֹלָ֣ה וְלִשְׁלָמִ֑ים לְכַפֵּ֣ר עֲלֵיהֶ֔ם נְאֻ֖ם אֲדֹנָ֥י יְהוִֽה׃,טו,מה,Ezekiel,11
דִּבְרֵ֣י עָמ֔וֹס אֲשֶׁר־הָיָ֥ה בַנֹּקְדִ֖ים מִתְּק֑וֹעַ אֲשֶׁר֩ חָזָ֨ה עַל־יִשְׂרָאֵ֜ל בִּימֵ֣י ׀ עֻזִּיָּ֣ה מֶֽלֶךְ־יְהוּדָ֗ה וּבִימֵ֞י יָרׇבְעָ֤ם בֶּן־יוֹאָשׁ֙ מֶ֣לֶךְ יִשְׂרָאֵ֔ל שְׁנָתַ֖יִם לִפְנֵ֥י הָרָֽעַשׁ׃,א,א,Amos,11
וְהִכֵּיתִ֥י בֵית־הַחֹ֖רֶף עַל־בֵּ֣ית הַקָּ֑יִץ וְאָבְד֞וּ בָּתֵּ֣י הַשֵּׁ֗ן וְסָפ֛וּ בָּתִּ֥ים רַבִּ֖ים נְאֻם־יְהוָֽה׃ ס,טו,ג,Amos,11
וַתַּשְׁק֥וּ אֶת־הַנְּזִרִ֖ים יָ֑יִן וְעַל־הַנְּבִיאִים֙ צִוִּיתֶ֣ם לֵאמֹ֔ר לֹ֖א תִּנָּבְאֽוּ׃,יב,ב,Amos,11
נִשְׁבַּ֨ע אֲדֹנָ֤י יְהוִה֙ בְּקׇדְשׁ֔וֹ כִּ֛י הִנֵּ֥ה יָמִ֖ים בָּאִ֣ים עֲלֵיכֶ֑ם וְנִשָּׂ֤א אֶתְכֶם֙ בְּצִנּ֔וֹת וְאַחֲרִיתְכֶ֖ן בְּסִיר֥וֹת דּוּגָֽה׃,ב,ד,Amos,11
נָֽפְלָה֙ לֹֽא־תוֹסִ֣יף ק֔וּם בְּתוּלַ֖ת יִשְׂרָאֵ֑ל נִטְּשָׁ֥ה עַל־אַדְמָתָ֖הּ אֵ֥ין מְקִימָֽהּ׃,ב,ה,Amos,1
שִׁמְע֞וּ אֶת־הַדָּבָ֣ר הַזֶּ֗ה אֲשֶׁ֨ר אָנֹכִ֜י נֹשֵׂ֧א עֲלֵיכֶ֛ם קִינָ֖ה בֵּ֥ית יִשְׂרָאֵֽל׃,א,ה,Amos,11
כַּאֲשֶׁ֨ר יָנ֥וּס אִישׁ֙ מִפְּנֵ֣י הָאֲרִ֔י וּפְגָע֖וֹ הַדֹּ֑ב וּבָ֣א הַבַּ֔יִת וְסָמַ֤ךְ יָדוֹ֙ עַל־הַקִּ֔יר וּנְשָׁכ֖וֹ הַנָּחָֽשׁ׃,יט,ה,Amos,1
הָסֵ֥ר מֵעָלַ֖י הֲמ֣וֹן שִׁרֶ֑יךָ וְזִמְרַ֥ת נְבָלֶ֖יךָ לֹ֥א אֶשְׁמָֽע׃,כג,ה,Amos,1
הַפֹּרְטִ֖ים עַל־פִּ֣י הַנָּ֑בֶל כְּדָוִ֕יד חָשְׁב֥וּ לָהֶ֖ם כְּלֵי־שִֽׁיר׃,ה,ו,Amos,11
כִּ֡י הִנְנִי֩ מֵקִ֨ים עֲלֵיכֶ֜ם בֵּ֣ית יִשְׂרָאֵ֗ל נְאֻם־יְהוָ֛ה אֱלֹהֵ֥י הַצְּבָא֖וֹת גּ֑וֹי וְלָחֲצ֥וּ אֶתְכֶ֛ם מִלְּב֥וֹא חֲמָ֖ת עַד־נַ֥חַל הָעֲרָבָֽה׃ ס,יד,ו,Amos,11
וַיִּשְׁלַ֗ח אֲמַצְיָה֙ כֹּהֵ֣ן בֵּֽית־אֵ֔ל אֶל־יָרׇבְעָ֥ם מֶֽלֶךְ־יִשְׂרָאֵ֖ל לֵאמֹ֑ר קָשַׁ֨ר עָלֶ֜יךָ עָמ֗וֹס בְּקֶ֨רֶב֙ בֵּ֣ית יִשְׂרָאֵ֔ל לֹא־תוּכַ֣ל הָאָ֔רֶץ לְהָכִ֖יל אֶת־כׇּל־דְּבָרָֽיו׃,י,ז,Amos,11
כִּי־כֹה֙ אָמַ֣ר עָמ֔וֹס בַּחֶ֖רֶב יָמ֣וּת יָרׇבְעָ֑ם וְיִ֨שְׂרָאֵ֔ל גָּלֹ֥ה יִגְלֶ֖ה מֵעַ֥ל אַדְמָתֽוֹ׃ ס,יא,ז,Amos,1
הִנֵּ֞ה עֵינֵ֣י ׀ אֲדֹנָ֣י יְהוִ֗ה בַּמַּמְלָכָה֙ הַֽחַטָּאָ֔ה וְהִשְׁמַדְתִּ֣י אֹתָ֔הּ מֵעַ֖ל פְּנֵ֣י הָאֲדָמָ֑ה אֶ֗פֶס כִּ֠י לֹ֣א הַשְׁמֵ֥יד אַשְׁמִ֛יד אֶת־בֵּ֥ית יַעֲקֹ֖ב נְאֻם־יְהוָֽה׃,ח,ט,Amos,1
וְעַל־בְּגָדִ֤ים חֲבֻלִים֙ יַטּ֔וּ אֵ֖צֶל כׇּל־מִזְבֵּ֑חַ וְיֵ֤ין עֲנוּשִׁים֙ יִשְׁתּ֔וּ בֵּ֖ית אֱלֹהֵיהֶֽם׃,ח,ב,Amos,1
כִּ֡י הִנֵּה֩ יוֹצֵ֨ר הָרִ֜ים וּבֹרֵ֣א ר֗וּחַ וּמַגִּ֤יד לְאָדָם֙ מַה־שֵּׂח֔וֹ עֹשֵׂ֥ה שַׁ֨חַר֙ עֵיפָ֔ה וְדֹרֵ֖ךְ עַל־בׇּ֣מֳתֵי אָ֑רֶץ יְהוָ֥ה אֱלֹהֵֽי־צְבָא֖וֹת שְׁמֽוֹ׃ ס,יג,ד,Amos,11
נִחַ֥ם יְהוָ֖ה עַל־זֹ֑את לֹ֥א תִהְיֶ֖ה אָמַ֥ר יְהוָֽה׃,ג,ז,Amos,11
נִחַ֥ם יְהוָ֖ה עַל־זֹ֑את גַּם־הִיא֙ לֹ֣א תִֽהְיֶ֔ה אָמַ֖ר אֲדֹנָ֥י יְהוִֽה׃ ס,ו,ז,Amos,1
